class,text
1,Reception; Sound Quality; Speakerphone; Display; Stand-by Time
1,Reception; Sound Quality; Speakerphone; Display; Stand-by Live Time
1,Reception; Sound Quality; Speakerphone; Display; Stand-by display
1,"Features, crystal-clear reception, tv-like screen, clarity, it's like having a phone, Gameboy, PDA in one!"
1,"Features, clear crystal-clear reception, tv-like presentation,, it's like having a phone, Gameboy, PDA in one!"
1,"Features, crystal-clear color reception, tv-like screen, clarity, it's like having plugged a phone, Gameboy, PDA in one!"
1,"3.34 megapixels, great lens, many modes, caters to amateurs and pros, crisp LCD screen"
1,"3.34 megapixels, great lens, many modes, caters delight to amateurs and pros, versatile screen"
1,"3.34 megapixels, great lens, many modes, caters to amateurs and collectors, crisp LCD resolution screen"
0,None
0,Home
0,null
1,"Easy to use, works at night, mpeg movie recording, size, memory works well with VAIO."
1,"Easy to monitor, at night, mpeg movie recording, size, memory works well with native VAIO."
1,"Easy to use, works at night, mpeg movie recording, size, memory works properly with VAIO."
0,Ugly and slow.
0,Ugly smells and slow.
0,Ugly texture and slow.
1,"Lightweight, games, Tones"
1,"Lightweight, games, travel"
1,"Lightweight, heavyweight games, Tones"
0,Did not load pictures to PC. Power monster. Display must be On during loading.
0,Did not load according to PC. Power monster. Audio must be On during loading.
0,Did not load pictures to PC. Power monster. Animated Display must be enabled during loading.
0,"Horrible battery life, turns off randomly and must re-input date/time"
0,"Horrible battery cap, turns off randomly and firmware must re-input date/time"
0,"Horrible battery life, turns off WiFi and must re-input seconds/time"
1,"Size, display, easy controls"
1,"Size, display, easy scaling"
1,"Size, scale, easy controls"
1,This printer does everything you could want.
1,This printer does everything which you could want.
1,This printer does everything you definitely want.
0,N/A
0,N/H A
0,N/M
1,"Solidly built, with a host of features."
1,"Solidly built, with hopefully a host of features."
1,"machine built, with a host of features."
0,"Poor ergonomics, poor sound."
0,"Poor ergonomics, poor headphone sound."
0,"Poor fluid ergonomics, poor sound."
1,"Small, inexpensive, loaded with features, easy to use, good quality photos."
1,"Small, inexpensive, loaded with features, easy to first use, good selfie photos."
1,"Small, inexpensive, loaded with features, easy to use, responsive tools."
1,None come to mind
1,None brought to mind
1,None come to every mind
0,"Phone shuts off unexpectedly, especially during calls. Sounds are static like"
0,"Phone shuts off lights unexpectedly, especially during calls. Sounds are static like"
0,"Phone shuts off unexpectedly, especially during calls. Sounds are static audio like"
0,"The new ""Compaq"" and ""Samsung"" compliant  cartridges don't work in it."
0,"The name ""Compaq"" and ""Samsung"" compliant  cartridges don't strictly work in it."
0,"The new ""Linux Compaq"" and ""Samsung"" compliant  servers don't work in it."
1,Very easy to use.  Great pictures on computer/printer.  Enough features to satisfy anyone
1,Very easy to use.  Built on lightweight computer/printer.  Enough features to satisfy anyone
1,Very easy to use.  Great pictures on blogger/printer.  Incredible features to satisfy anyone
1,Fast and trouble free
1,Fast and fuss free
1,Fast and trouble advertising free
0,"Focus range begins at 4 feet, lens unprotected."
0,"Focus range begins at 4 kHz, unprotected."
0,"Focus range begins at some 4 feet, lens unprotected."
0,slow
0,Home
0,Resources
1,"Ultra cool, good resolution, excellent image quality, highly portable, uses AAA batteries"
1,"Ultra cool, comfortable, excellent image quality, highly portable, uses plentiful batteries"
1,"Ultra real cool, good resolution, excellent image quality, highly portable, uses AAA batteries"
0,too many to list
0,too many to consider
0,too many to truly list
1,Easy to Use
1,Easy to Config Use
1,Easy to Know
0,Complicated. Too small?
0,Complicated. Something small?
0,Complicated. Use Too small?
1,"Great reception, easy to learn how to use."
1,"Great app, easy to learn how to use."
1,"Great touch reception, easy to learn how to use."
1,Very light weight. Good clear outdoor daytime pictures.
1,Very light average weight. Good clear outdoor daytime pictures.
1,Very light weight. Good clear and daytime pictures.
0,"Autofocus has problems in low light, fragile power/lens cover switch"
0,"Mine has died in low light, fragile power/lens cover switch"
0,"unit has problems in low light, fragile power/mount cover switch"
0,design isn't on par with other Epson printers
0,design isn't on near par with other Epson printers
0,design isn't priced on par with other Epson printers
1,Easy to carry around
1,Easy to carry in
1,Easy to carry supplies around
1,quality pictures
1,quality coverage
1,quality promotional pictures
0,No more excuses for not running
0,No more excuses for drivers not running
0,No more excuses waiting for not running
0,Size - but it is easy to get used to
0,Size - but it is easy to soon get used to
0,tricky - but it is easy to get used to
1,"Easy to use, good pictures, reasonably priced"
1,"Easy to use, good street pictures, reasonably priced"
1,"Easy ways to use, good pictures, reasonably priced"
1,Has all Palm functions; interesting conversation piece
1,Has all Palm Panel functions; interesting conversation piece
1,Has all Palm functions; interesting conversation threads
1,"great for casual users, nice features for price range, easy to use"
1,"great for casual users, lacking features for accessibility, easy to use"
1,"great for casual users, shows nice features for price range, easy to use"
0,"Made for a small child (in my opinion), bends easily"
0,"Made for a small child (in my opinion), bends more easily"
0,"Made good for a small child (in my opinion), bends easily"
1,"2xAAs,USB,NTSC Videos-sound, Semi pro, automatic lense cover,aluminium case"
1,"2xAAs,USB,NTSC Videos-sound, Semi pro, automatic lense dust cover,aluminium case"
1,"2xAAs,USB,NTSC Videos-sound, Semi pro, poly lense casing,aluminium case"
1,good crisp color screen
1,good crisp color option
1,good crisp display screen
0,"Mediocre battery life, Keypad response"
0,"Mediocre battery lasts life, Keypad response"
0,"Mediocre battery life, sluggish response"
1,"Good quality, very easy, compact, fast file transfer."
1,"Amazing quality, very easy, compact, fast file transfer."
1,"Higher quality, very easy, compact, fast file transfer."
1,"Reliable, Good Phone"
1,"OK, Good Phone"
1,"Reliable, Good Ideas"
1,"Prints, Scans, and Copies"
1,"Prints, Scans, and Tape Copies"
1,"apes, Scans, and Copies"
1,1200 dpi&amp;#13;&amp;#10;microfine toner
1,1200 dpi&amp;#13;&img;#10;microfine toner
1,1200 dpi&amp;#number 13;&amp;#10;microfine toner
0,Cost
0,Advertisements
0,ends
1,"Sleek, Lightweight, Durable, Awesome battery life."
1,"Sleek, Clean, Durable, Awesome battery life."
1,"Sleek, Lightweight, Most Durable, Awesome battery life."
1,"Easy to use, inexpensive, affordable media"
1,"Easy internet to use, inexpensive, affordable media"
1,"Easy to use, inexpensive, affordable new media"
0,Too small?
0,Too big?
0,Too obviously small?
0,"external antena can break, black/white screen, lousy games"
0,"external antena lights can break, black/white screen, lousy games"
0,"external files can break, black/white screen, lousy games"
0,"resolution only goes up to 640x480, only handles 8mg smartmedia cards"
0,"resolution screens up to 640x480, only allows smartmedia cards"
0,"resolution version only goes up to 640x480, only handles 8mg smartmedia cards"
1,"Easy to use, good interface&amp;#13;&amp;#10;great ""gadget"" appeal&amp;#13;&amp;#10;"
1,"Easy to properly use, good interface&amp;#13;&amp;#10;Adds great ""gadget"" appeal&amp;#13;&amp;#10;"
1,"Easy to use, handy interface&amp;#13;&amp;#10;great ""gadget"" appeal&plus amp;#13;&amp;#10;"
0,Just a Bit Pricey!
0,Just a Bit More Pricey!
0,Just a few Bit Pricey!
0,"expensive upfront cost and consumerables, slow to warm up out of standby mode"
0,"expensive CPU upfront cost and consumerables, slow to warm up out of standby mode"
0,"expensive upfront cost and consumerables, slow to warm up out of wireless standby mode"
1,"easy to use, saves to disk"
1,"Library to use, saves to disk"
1,"easy to use, saves backup to disk"
0,Zero customer service
0,Zero box service
0,Zero coupon service
1,good color
1,Dark color
1,good black color
0,Minor nozzle clogging issue in some situations
0,Minor nozzle clogging issue fixed in some situations
0,The nozzle clogging issue in some situations
1,"excellent quality, quick and quiet"
1,"excellent quality, quick and enjoyable"
1,"excellent quality, speedy and quiet"
0,"expensive, power button confused with exposure button"
0,"expensive, power button confused with quick exposure button"
0,"expensive, power button prompts confused with exposure button"
1,4 Megapixels. Movie mode. Great pictures!
1,4 Megapixels. Movie Ready mode. Great pictures!
1,4 screens. Movie mode. Great pictures!
0,poor mpeg movie quality
0,poor mpeg SD movie quality
0,poor mpeg k movie quality
0,more noise than the s45 (the s50's 4MP stablemate)
0,more noise than the s45 (the Toyota s50's 4MP stablemate)
0,more noise than the s45 (the quieter s50's 4MP stablemate)
1,"6X Zoom, Incredibly Sharp Detail"
1,"6X Zoom, Incredibly Sharp Surface Detail"
1,"Laser Zoom, Incredibly Sharp Detail"
0,"Costly paper and ink, and not much paper to choose from by Epson"
0,"Costly paper and ink, and not glossy paper to choose from judging by Epson"
0,"Costly paper and ink, and not much paper to still choose from by Epson"
0,"Cartridge cost, quality"
0,"Cartridge cost, retail quality"
0,"Cartridge cost, wood quality"
0,Cannot download ringers
0,Cannot directly download ringers
0,Download download ringers
0,Not small compared to other cams.  Hard to find.
0,Not small compared to other cams.  Hard to fully find.
0,Not small comparisons to other cams.  Hard to find.
0,"The battery life is lacking, no other real problems"
0,"The battery life aspect is lacking, no other real problems"
0,"The battery life is lacking, no stability problems"
0,Hidden costs
0,Hidden Room
0,Hidden administrative costs
0,Unable to print at all if one cartridge is empty. 
0,Unable to print at all if one cartridge size is empty. 
0,Unable to print at all if one cartridge window is empty. 
1,Good Quality prints and easy setup.
1,Good Quality prints Quick and easy setup.
1,Good Quality prints and easy packaging.
1,"Lightweight, easy to use, free"
1,"Lightweight, easy to use, removable"
1,"Lightweight, generally easy to use, free"
1,Many options/light weight/games/stores 99 names/numbers
1,Many numbers/light weight/games/stores 99 names/numbers
1,Many options/light bars//stores 99 names/numbers
1,Small and suprisingly heavy!
1,Small and suprisingly pretty heavy!
1,Small enough and suprisingly heavy!
1,Inexpensive Photo Quality
1,Inexpensive Video Photo Quality
1,Review Photo Quality
0,"makes a bit of noise, takes time on quality print jobs"
0,"makes a bit of history, takes up time on quality print jobs"
0,"makes a bit of noise, takes time on administrative typing jobs"
1,wide  enough  to  drive and  make  calls
1,wide  enough  to  drive and  make  distress calls
1,wide  enough  to  drive and  make  sound
1,"Looks AMAZING, Works Great, Impresses People"
1,"Looks AMAZING, Works Great, Probably Impresses People"
1,"Looks AMAZING, Works Us Great, Impresses People"
0,"Paper feed, noise, printer driver"
0,"Paper feed, noise, printer door driver"
0,"Paper tag, noise, printer driver"
1,excellent camera
1,excellent RAW camera
1,phone camera
1,"Small, good quality pics"
1,"Overall, good quality pics"
1,"Small, good quality camera pics"
0,Only 2x zoom
0,Only by 2x zoom
0,Only window zoom
1,"excellent image quality, decent speed, good looking"
1,"excellent fit, decent speed, good looking"
1,"excellent image quality, decent speed, and good looking"
1,"fast, quiet, IR, great quality"
1,"fast, deep quiet, IR, great quality"
1,"quiet, quiet, IR, great quality"
0,"Lousy phone! Bad speakers, poor functionality, not intuitive, JUNK, JUNK, JUNK! Avoid this phone."
0,"Lousy phone! Bad speakers, disappointing functionality, not intuitive, JUNK, JUNK, JUNK! Avoid this cheap phone."
0,"Lousy phone! Bad speakers, poor functionality, not intuitive, JUNK, GOD JUNK, JUNK! Avoid this fiasco."
0,thirsty for ink  (not worse than other inkjets)
0,thirsty for ink  (not always worse than other inkjets)
0,thirsty for ink  (not worse than other Japanese inkjets)
0,Complicated to understand at times because of small size.
0,Complicated to understand at times because of exceptionally small size.
0,Complicated to understand at times inconvenient because of small size.
1,Very easy to use and download pictures with supplied software
1,Very easy to use and download pictures built with supplied software
1,Very incredibly easy to use and download pictures with supplied software
0,image quality bad during low as well as too much light
0,image quality bad during production as well as poor light
0,image quality being bad during low as well as too much light
1,"it works, it's cheap, it's small, ink is cheap"
1,"it works, it's SO cheap, it's small, ink is cheap"
1,"it works, it's cheap, and it's small, ink is cheap"
1,"Cheap, Printing in black and white is fairly good"
1,"Cheap, Printing in basic black and white is fairly good"
1,"Cheap, Printing in black and white is fairly inexpensive"
0,"location of lens makes it easy to block when holding, menu is difficult to manage"
0,"location of lens makes it easy to block when navigating, menu is difficult to directly manage"
0,"location of lens makes it easy to rotate block finder, menu is difficult to manage"
0,sensitive to motion in low light
0,sensitive to motion in ordinary low light
0,susceptibility to motion in low light
0,Power consumption; should be sold with the 'optional' power kit included.
0,Power consumption; should likely be sold with the 'optional' power kit included.
0,Power maximum consumption; should be sold with the 'optional' power kit included.
1,"cheap, good quality"
1,"Fast, good quality"
1,"cheap, good audio quality"
0,Joystick is a little frustrating and face plate chips easily
0,Joystick is a reasonably frustrating and wipes plate chips easily
0,Joystick is frequently frustrating and face plate chips ineffective
0,Price
0,References
0,Resources
0,"Sub-par sound, awkward menu layout"
0,"Fast sound, awkward menu layout"
0,"Sub-par sound, some awkward menu layout"
1,Folding lens avoids scratching.  Easy and accurate photo-taking.  Inexpesive.
1,Folding lens erg scratching.  Easy and accurate photo-taking.  Inexpesive.
1,Folding lens slightly avoids scratching.  Easy and accurate photo-taking.  Inexpesive.
0,"Battery life, fragile antenna, slow software, very few ""perks""."
0,"Battery screen, fragile antenna, slow software, very few ""perks""."
0,"shelf life, fragile antenna, slow software, very few ""perks""."
1,Inexpensive and reliable.
1,Inexpensive and wildly reliable.
1,Inexpensive equipment and reliable.
0,quality
0,Pinterest
0,Trivia
1,"Small size, good durable battery pack, voice controls."
1,"Small size, good durable battery pack, sturdy controls."
1,"Small size, good heavy battery pack, voice controls."
0,"high ink useage, software is difficult to install properly on Win XP"
0,"high definition, software is difficult to install properly on Win XP"
0,"high ink back useage, software is difficult to deploy properly on Win XP"
1,Colour fidelity and resolution
1,Colour age and resolution
1,Colour fidelity strength and resolution
0,I don't like them
0,I don't like having them
0,I don't owe them
0,"does NOT support rechargeable batteries, short battery life, no lens cover"
0,"does NOT support rechargeable batteries, Very short battery life, no rear cover"
0,"does NOT support rechargeable batteries, short battery extended life, no lens cover"
1,Great Photos/Floppy Storage
1,Digital Photos/Floppy Storage
1,Great RAW Photos/Floppy Storage
0,"initial price, text print slow, poor text print on plain paper"
0,"initial cursor, text print slow, poor text print on printing paper"
0,"initial price, text print slow, poor text print layout on plain paper"
1,"2.1 Megapixel, cheap, easy to use"
1,"2.1 Megapixel, cheap, easy download to use"
1,"2.1 Megapixel, portable, easy to use"
0,n/a
0,hat/a
0,s/a
1,"Small, Lithium battery, Great colours"
1,"Case, Lithium battery, Great colours"
1,"Small, Lithium battery, glossy colours"
1,1 minute digital videos with sound&amp;#13;&amp;#10;Compact and durable&amp;#13;&amp;#10;
1,1 Rated digital videos with digital&digital amp;#13;&amp;#10;Compact and durable&amp;#13;&amp;#10;
1,1 million digital videos with sound&touch amp;#13;&amp;#10;Compact and durable&amp;#13;&amp;#10;
1,Good quality inexpensive initially
1,Best quality inexpensive initially
1,Good quality artwork initially
0,un-clear printing quality
0,un-clear air quality
0,un-clear printing improves quality
0,Super sensitive touch controls - Doesn't work well with certain Bluetooth devices.
0,Super clever touch controls - Doesn't work well with Apple Bluetooth devices.
0,Super tight controls - Doesn't work well with certain Bluetooth devices.
1,Well built reasonably priced dual mode phone. Has lasted me nearly two years.
1,Well built reasonably priced Bluetooth dual mode phone. Has lasted me nearly two years.
1,Well built reasonably priced dual multit mode phone. Has lasted me nearly two years.
0,not enough internal memory
0,not enough internal solid memory
0,not preserving internal memory
0,Definitaly use  an Adapter
0,Also use  an Adapter
0,Definitaly use  alongside an Adapter
0,You will never be able to move it again
0,You hopefully will never be able to move it again
0,You will never be able to trust it again
1,"inexpensive for its size, cute design,very durable"
1,"inexpensive for its size, cute little design,very durable"
1,"noteworthy for its size, cute design,very durable"
0,"Software Problems, Hardware Problems, Printing Problems, Hours spent with tech support"
0,"Software Development, Problems, Installation, Hours spent with tech support"
0,"Software Problems, Payment Problems, Printing Problems, Hours spent with tech professionals"
0,Doesnt come with rechargables.
0,Doesnt mesh with rechargables.
0,Phones come with rechargables.
1,size and cost
1,size and bold
1,size scope and cost
1,price value style
1,True value style
1,price ebook style
0,Rechargeable battery doesn't last long.
0,Rechargeable battery doesn't always last long.
0,Rechargeable hydrogen doesn't last long.
1,"Camera Quality, Mp3 Ringtones, Solid build, Good screen quality"
1,"Camera Quality, Mp3 Ringtones, Black Solid build, Good screen quality"
1,"Camera Quality, Mp3 Ringtones, Solid leather build, Good screen quality"
1,"Ease of set up, speed, quality"
1,"Ease of service set up, speed, quality"
1,"Ease of set up, speed, pricing"
0,Battery life (minor problem)
0,Battery life (minor battery problem)
0,Battery life (minor fitness problem)
1,"Excellent print quality, extremely inexpensive."
1,"Excellent print quality, comparatively inexpensive."
1,"Excellent print quality, shockingly inexpensive."
1,"Nice, Fast,"
1,"Nice, Get Fast,"
1,"Nice, uh,"
1,"handy,  and easy to use"
1,"Light,  and easy to use"
1,"handy,  pleasant and easy to use"
0,"Weak flash, poor battery life"
0,"Weak flash, degraded battery life"
0,"Weak flash, poor battery juice life"
0,Reception SOMETIMES choppy.
0,Reception SOMETIMES AND choppy.
0,Reception TO SOMETIMES choppy.
1,"Inexpensive, easy to use, compact"
1,"Inexpensive, easy to use, surprisingly compact"
1,"Inexpensive, hopefully easy to use, compact"
1,Tons of Features
1,Tons of Advanced Features
1,Tons of Steel
0,Poor video
0,Poor audition video
0,Poor comparison video
0,"No optical zoom, slow shutter speed, short battery life, USB would be nice"
0,"No audio, slow shutter speed, short battery life, USB would be great"
0,"No fast zoom, slow shutter speed, short battery life, short USB would be nice"
0,takes some experimenting with features
0,Take some experimenting with features
0,takes some difficulty experimenting with features
0,"not real sturdy, lots of features to learn with poor explanations"
0,"not obvious, lots of features slow to learn with poor explanations"
0,"not real sturdy, lack of features to easily learn with poor explanations"
1,"Good amount of features, good battery life"
1,"Good amount of maintenance, good battery life"
1,"Good suite of features, good battery life"
1,"Excellent color quality, high pixel rating, makes movies and more!"
1,"Excellent color quality, fair basic pixel rating, makes movies and more!"
1,"Excellent saturated color quality, high pixel rating, makes movies and more!"
1,Bad battery life and freezes up.
1,Bad battery life and freezes builds up.
1,Bad battery starts and freezes up.
1,"Ease of use, mac-compatible, attractive, affordable, value for money"
1,"Ease of mass use, mac-compatible, attractive, affordable, value for money"
1,"Ease of use, mac-compatible, attractive, affordable, value for consumer"
0,"Um.... well, Canon doesn't give them away for free.   "
0,"Um.... well, Canon doesn't give them away for download.   "
0,"Um.... well, Canon doesn't give them away today for free.   "
0,not as fast as some
0,not all as fast as some
0,not as dead fast as some
0,It is a little slow on printing!
0,It is a little rough on printing!
0,It is a tiny little slow on printing!
0,Difficult to turn phone off and on
0,Difficult to get phone off and on
0,Difficult to get turn phone off and on
1,"Folds compactly, easy to load, very affordable"
1,"Folds compactly, easy to load, very conveniently affordable"
1,"Folds compactly, easy to reduce load, very affordable"
1,lots of useful options
1,lots of commercially useful options
1,lots of useful ideas
1,Beautiful colored screen and lots of options. Love the blue lighted keys.
1,Beautiful colored screen and lots of audio options. Love the blue lighted keys.
1,Beautiful colored screen and lots of options. Love the blue orange lighted keys.
1,"Small without being too small, features, Lithium Battery, internet"
1,"Small without being too small, packing features, Lithium Battery, internet"
1,"Small without fancy being too small, features, Lithium Battery, internet"
1,Great print quality. Stand alone copy feature is handy. 
1,Great print quality. Loading Stand alone copy feature is handy. 
1,Great print quality. Stand alone cloud copy feature is handy. 
1,"small, lightweight, sleek, durable"
1,"small, simple, sleek, durable"
1,"small, slightly lightweight, sleek, durable"
0,Sucks ink like Dracula sucks blood.
0,Sucks ink like Dracula sucks out blood.
0,Sucks ink like milk sucks blood.
0,Rechargable batteries almost a must; sometimes shifts to video mode unintentionally (due to dial placement)
0,Rechargable batteries almost are a must; sometimes shifts to video mode unintentionally (thanks to dial placement)
0,portable batteries almost a must; sometimes shifts to video mode unintentionally (due to erroneous dial placement)
1,"light weight, AIM, Yahoo features, compact design!"
1,"Real weight, AIM, Yahoo features, compact design!"
1,"light weight, AIM, Yahoo features, UI design!"
0,"no support CompactFlash, a little slow, poor batteries"
0,"no disk support CompactFlash, a little slow, poor batteries"
0,"no support CompactFlash, a motherboard, poor batteries"
1,"many features, great quality"
1,"many features, great features"
1,"many features, great software quality"
1,"Durable, Clear Reception, Easy to use interface"
1,"Durable, Allows Clear Reception, Easy to use interface"
1,"Durable, Clear Reception, Small Easy to use interface"
0,Not a beginner's camera
0,Not a beginner's exercise
0,Requires a beginner's camera
0,A bit slower when printing in color.
0,A bit slower variation in color.
0,A bit slower when printing documents in color.
1,"Excellent print quality, fast, reliable, economy mode, Mac Serial, PC Parallel, and USB interfaces."
1,"Excellent print quality, fast, reliable, economy mode, Mac Serial, PC Parallel, and Windows USB interfaces."
1,"Excellent print quality, native,, economy mode, Mac Serial, PC Parallel, and USB interfaces."
0,Finding a vendor that carries the phone
0,Finding a vendor that carries the label
0,Finding a vendor that carries the technology
0,"No flash, poor pictures, and you can't see the pics until you download."
0,"No flash, poor pictures, and you can't see above the pics until you download."
0,"No flash, poor pictures, and you can't see up the pics until you download."
0,"Poor reception/dropped calls, ineffective vibrate mode, some design flaws"
0,"Phone reception/dropped calls, idle mode, some design flaws"
0,"Poor reception/dropped calls, ineffective vibrate mode, some design engine flaws"
1,Easy to set up and use. Great quality photos.
1,Easy to set up and for use. Great quality photos.
1,Easy to set up and use. Pictures Great quality photos.
0,none
0,Notes
0,SHARE
1,"Compact, light, good quality, great flash!"
1,"Compact, light, durable quality, great flash!"
1,"Compact, light, good quality, have great flash!"
1,Great Photo Prints
1,Great Canadian Photo Prints
1,Great Photo Series
1,"Extremely durable, looks fantastic, ultra compact and takes great pictures"
1,"Extremely durable, looks fantastic, ultra compact and amazingly takes gorgeous pictures"
1,"Extremely durable, looks fantastic, ultra compact nowadays and takes great pictures"
1,"Low Price, Professional-Looking Documents"
1,"Low Price, Affordable Professional-Looking Documents"
1,"Low Price, Professional-Looking Printing Documents"
1,Quality Pictures; Video Recording; Build Quality; Compact; Extras
1,Quality Pictures; Video Recording; HDR; Compact; Extras
