class,text
1,Quality Pictures; Video Recording; Quality; Compact; Extras
1,"Ease of setup, price, paper handling"
1,"Details of setup, price, paper handling"
1,"Ease of entry, price, paper handling"
1,"Easy, zoom lens, no computer hookup,"
1,"Easy, wireless zoom lens, no computer hookup,"
1,"Easy, zoom controls, no computer hookup,"
0,Small display size
0,Small display device size
0,Small display small size
1,software is pretty good
1,software client is pretty good
1,software is damn good
0,"poor, poor reliability"
0,"poor, poor babies"
0,"poor, poor maintenance reliability"
0,"difficult to get flash perfect, resolution slightly obsolite"
0,"difficult design to get flash perfect, resolution slightly obsolite"
0,"difficult to manually get flash perfect, resolution slightly obsolite"
0,"None so far, really !"
0,"None so far, everyone !"
0,"Nothing so far, really !"
1,"Weight, backlight, stylish design, quite a few improvements."
1,"Weight, backlight, stability, quite a few improvements."
1,"Weight, backlight, stylish design, quite a few noticeable improvements."
1,"Small Size, Infolithium Battery, Metal Design"
1,"Shield Size, Infolithium Battery, Metal Design"
1,"Small Size, Infolithium Sensor Battery, Metal Design"
0,"Battery doesn't last long, memory is tight"
0,"Battery doesn't last any long, memory is tight"
0,"Battery doesn't last long, memory is exceedingly tight"
1,"A heckuva deal for a reliable, unbulky laser printer."
1,"A heckuva deal for a reliable, unbulky ABS printer."
1,"A tip for a reliable, unbulky laser printer."
1,"Size, Weight, Simple to use, "
1,"Size, Weight, Simple approach to use, "
1,"Size, Weight, Simple to effectively use, "
1,"Price, Speed, Cost of Maintenance, Performance"
1,"Price, Speed, Cost of Maintenance, High Performance"
1,"Price, Speed, Cost of Service, Performance"
0,"Camera size is too big, many features that beginners don't use"
0,"Camera range is admittedly too big, many features that beginners don't use"
0,"Camera size is unfortunately too big, many features that beginners don't use"
1,"Good picture quality, good price"
1,"Good packaging, good price"
1,"Good work quality, good price"
1,It's small and looks cool.
1,It's small and now looks cool.
1,It's small and remarkably cool.
1,"easy to use, review/preview options, easy to download"
1,"easy to use, review/improve, easy to download"
1,"easy to use, review/preview comments, easy to download"
0,"Inadequate operating system to manage memory, freeze ups, power cycling the phone daily"
0,"Inadequate operating procedure system to manage memory, freeze ups, power cycling the phone daily"
0,"Inadequate operating system ability to manage memory, freeze ups, power cycling the phone daily"
1,"Color screen,speaker phone,camera capability,and the web."
1,"Color screen,speaker phone,camera capability,and the new web."
1,"Color screen,speaker phone,camera capability,and the projector."
1,"great, crisp photos."
1,"great, crisp cider."
1,"great, inspiring photos."
1,Easy usb connection
1,Easy usb controller connection
1,Easy web connection
0,"Makes a mess of the ink platen, borders, no roll adapter"
0,"Makes UP a mess of the ink platen, borders, no roll adapter"
0,"Makes a mess of the burnt ink platen, borders, no roll adapter"
1,Wonderful Quaility
1,Paul Quaility
1,Wonderful Tropical Quaility
0,Needs expensive paper to produce photo quality images
0,Needs expensive paper to produce photo capture images
0,Needs people to produce photo quality images
1,"Great when it works, Great in handling multiple paper sizes."
1,"Great when it works, Great convenience in handling multiple paper sizes."
1,"Great when it works, Great in small paper sizes."
1,Good Software feature
1,Good Software Works
1,Good Software hygiene feature
0,"Weak reception, No Vibrator Ringing"
0,"Weak initial reception, No Vibrator Ringing"
0,"Weak reception, No Constant Ringing"
0,"Weird interface, software crash, ear bug sux, no web??? IR port not working..."
0,"Weird chat interface, software crash, ear bug sux, no web??? IR port not working..."
0,"Weird interface, software crash, ear ache bug sux, no web??? IR port not working..."
0,occasional fuzzy spots
0,occasional fuzzy hair spots
0,occasional fuzzy poop spots
0,"Battery Life, made out of poor plastic , can not play internet games on this."
0,"Battery Free Life, made out of poor plastic , can not play internet games on this."
0,"Battery Life, made out of poor coloured plastic , can not play internet games on this."
0,"Weak flash, Not the best in &amp;quot;auto&amp;quot; low light"
0,"Weak flash, Not the best in &amp;r;&;quot; low light"
0,"full weight, Not the best in &amp;quot;auto&amp;quot; low light"
1,"Bright LCD Screen, External LCD, Clear and Beautiful Ringtones"
1,"Bright LCD Screen, External Dimensions, Clear and Beautiful Ringtones"
1,"Bright LCD Screen, External LCD, Clear Pen and Beautiful Ringtones"
0,"Some of the frills, such as the optional borders, are not very useful."
0,"Some of the frills, generally such as the optional borders, are not very obvious."
0,"Some of the smaller frills, such as the optional borders, are not very useful."
1,"great pictures, fast downloads, nice camera body, customer support"
1,"great pictures, fast downloads, nice camera body, video support"
1,"great pictures, fast downloads, slick camera body, customer support"
1,"Inexpensive, easy to upload, easy to carry around, good picture quality"
1,"Inexpensive, easy to upload, easy to navigate UI, good picture quality"
1,"Small, easy to upload, easy to carry anywhere, good picture quality"
0,None really other than the 8M Smartmedia card shipped with camera a little small.
0,None really other than possibly the 8M Smartmedia card shipped with camera a little small.
0,None really other than the 8M Smartmedia card shipped with camera a little overly small.
1,Excellent to handle.  Comfortable ride.  The canopy is perfect for those really sunny days.
1,Excellent to first handle.  Comfortable ride.  The canopy is perfect for those really sunny days.
1,Excellent to handle.  Comfortable ride.  The canopy is perfect for those sunny really sunny days.
1,"Reliable, easy, floppy is ultimate in convenience."
1,"Reliable, easy, coffee is ultimate in convenience."
1,"Reliable, easy, floppy is unparalleled in convenience."
0,Paper curls.
0,Paper gate.
0,Paper tigers.
0,tends to bend cheap light weight paper when starting a print job
0,Need to bend cheap light weight paper thin when starting a print job
0,tends to bend cheap light weight paper when starting a normal print job
0,No optical zoom
0,Improved optical zoom
0,No optical doping
0,"No Flash, No Picture Preview screen, Pictures are stored in RAM"
0,"No Flash, No Picture Preview in screen, Pictures are stored in RAM"
0,"No Flash, No Picture Preview screen, Movies are stored in HD"
0,low resolution pictures are really not worth the effort.
0,low resolution pictures are really not worth the bother.
0,low resolution pictures maybe not worth the effort.
1,"Easy to operate, good quality outdoor pictures, sliding lens cover"
1,"Easy to operate, capturing quality HDR pictures, sliding lens cover"
1,"Easy to operate, includes good quality outdoor pictures, sliding lens cover"
0,"No optical zoom, port covers flimsy, flash needs recharging time, limited options"
0,"Missing optical zoom, port covers flimsy, flash needs recharging additional time, limited options"
0,"No optical zoom, port covers flimsy, flash needs recharging time, unlimited print options"
1,Worthy replacement to the 950 and 990.
1,Worthy Guide to the 950 and 990.
1,Worthy replacement to support the 950 and 990.
0,"Nothing, except people annoying you asking &amp;quot;What is that&amp;quot;"
0,"Nothing, except people annoying you asking &amp;quot;What is just that&amp;quot;"
0,"Nothing, other clever people annoying you asking &amp;quot;What is that&amp;quot;"
1,"Compact, Feature laden, Great Zoom for size and reasonable price."
1,"Compact, Feature laden, Great Zoom for size and reasonable premium price."
1,"Compact, Feature laden, great for size and reasonable price."
1,Light small
1,Photo small
1,appears small
1,"Compact, Lightweight, Takes great photos in daylight"
1,"Compact, Lightweight, Takes Some great photos in daylight"
1,"Compact, Lightweight, enables great photos in daylight"
0,software
0,Abstract
0,Edit
1,Great software and easy to use.
1,Great software and certainly easy to use.
1,Great software and pleasant to use.
0,Slower Shutter response that any Film Camera.
0,Slower Shutter Camera response that any Film Camera.
0,Slower Shutter faster that any Film Camera.
1,"Relatively inexpensive, easy to use, simple Finepix software"
1,"Relatively inexpensive, easy to use, simple Finepix Setup"
1,"Relatively inexpensive, straightforward to use, simple Finepix software"
0,Trouble with graphics.
0,Trouble with HDR graphics.
0,Trouble with computers.
0,cost a lot
0,Save a lot
0,cost quite a lot
1,"Color Screen, Price"
1,"Color Screen, Graphics"
1,"Color Screen, Text"
1,Great quality enlargements.
1,Great quality laser enlargements.
1,superior quality enlargements.
1,Great value...Packed with features...Easy to use...Large lcd screen...Sharp pictures
1,Great value...Packed with features...Easy to use...Large thin lcd screen...Sharp pictures
1,Great value...Packed with features...Easy to use...pretty Large lcd screen...Sharp pictures
1,Easy to manuever
1,Easy to get manuever
1,Easy to learn manuever
1,"good zoom, expandable memory is a plus, good resolution for an entry level camera "
1,"good zoom, larger memory is a plus, good resolution for choosing an entry level camera "
1,"good zoom, portable memory is a plus, good resolution choice for an entry level camera "
1,"Good quality print, Compaq support was great (once they were on the phone line)."
1,"Good quality print, Compaq support was great (once that they were on the phone line)."
1,"excellent quality print, Compaq support was great (once while they were on the phone line)."
1,"Easy to use, price is right, saves you money in the long run if you love to take pictures.   "
1,"Easy to use, Camera is right, saves you money in the long run if you love to take still pictures.   "
1,"Easy to use, price is cheaper, saves you money then in the long run if you love to take pictures.   "
0,Price
0,Abstract
0,Print
0,"Slight auto focus lag, kind of expensive."
0,"Slight auto brake lag, kind of expensive."
0,"Slight auto maintenance lag, kind of expensive."
0,"horrible service, nothing but problems"
0,"Perfect service, nothing but problems"
0,"horrible toilet service, nothing but problems"
0,"Durability, Lack of Speakerphone, Ringtones, BATTERY!"
0,"Durability, Lack of Power, Ringtones, BATTERY!"
0,"Durability, Lack of Speakerphone, Ringtones, Weight!"
1,"small size, cool look, headset"
1,"small size, cool UI, headset"
1,"small size, ugly look, headset"
0,Slightly big in size and weird number pad layout.
0,Slightly big in size and weird er number pad layout.
0,Slightly big in size and weird number pad configuration.
1,"8cm CD recorder, light weight, 4 mp, tons of features, records video, and it's Sony!!"
1,"8cm CD recorder, light weight, 4 mp, tons of features, records home video, and it's legit Sony!!"
1,"magic mono recorder, light weight, 4 mp, tons of features, records video, and thinks it's Sony!!"
0,Questionable quality and occasional smudging.
0,Questionable quality and also occasional smudging.
0,Questionable quality and occasional quirks.
0,To get use with the menu sometimes seems a little bit strange
0,To get use with the menu sometimes seems me a little bit strange
0,To get use with tweaking the menu sometimes seems a little bit strange
1,Effective combination of phone and PDA; you get what you pay for.
1,Effective combination effect of incentives and PDA; you get what you pay for.
1,Effective combination of phone and app PDA; you get what you pay for.
1,"Small, 3x optical zoom, intuitive controls."
1,"Small, 3x optical zoom, intuitive tactile controls."
1,"Small, smooth optical zoom, intuitive controls."
0,Low battery life compared to other phones I've owned.
0,Low battery capacity compared to other phones I've owned.
0,Low battery life compared to other phones formerly owned.
1,"Reliable, comfortable size, clear sound, 200hrs+ standby, Bluetooth earphones, + so much more"
1,"Reliable, impressive size, clear sound, comfort+, Bluetooth earphones, + so much more"
1,"Reliable, stable, clear sound, 200hrs+ standby, compact earphones, + so much more"
0,"A little slow but hey, what do u want for les than $200"
0,"A little slow but hey, what do u normally want for les than $200"
0,"A little slow but hey, what do u want for even les than $200"
0,"Antenna, not many options, text messaging"
0,"Antenna, not many laptops, text messaging"
0,"Antenna, not many options, mixed messaging"
1,"great price for the excellent quality, ease-of-use"
1,"great price for the cheapest excellent quality, ease-of-use"
1,"great price for the exceptional quality, ease-of-use"
0,"Big, Noisey &amp; Ink Thirsty"
0,"Big, Noisey &Cool; Ink Thirsty"
0,"Big, Noisey &amp; Ink eless"
0,software is slow and time consuming
0,software is slow and trouble consuming
0,software is ugly and time consuming
1,Good if you are rich
1,Good if you are exceptionally rich
1,Good if you are starving
0,Communicam
0,Resources
0,Sources
1,Ease of use.&amp;#13;&amp;#10;Three separate color ink vials plus a black.&amp;#13;&amp;#10;Quite.
1,Ease of use.&amp;#13;&amp;#col 10;Three separate color ink less vials plus a black.&amp;#13;&amp;#10;Quite.
1,Rules of use.&amp;#13;&amp;#10;Three separate color ink vials plus brushes.&amp;#13;&amp;#amp 10;Quite.
0,"Battery Life when browsing, Bulky"
0,"Battery Life when Smart, Bulky"
0,"Battery Life when browsing, iOS"
1,"Ease, no developing, nice LCD display"
1,"Ease, no developing, nice LCD back display"
1,"Ease, no developing, really nice LCD display"
0,Small multiple use buttons.
0,Small multiple stores use buttons.
0,Small multiple use sizes.
1,"Handles well, attractive, both seats recline (although not fully), light compared to other doubles"
1,"Handles mesh well, attractive, both seats recline (although not fully), light compared to other doubles"
1,"Handles well, attractive, both seats recline (although not fully), light compared to any other doubles"
1,"Easy to use,Great pictures"
1,"Easy to moderate use,Great pictures"
1,"Easy to use,fun Great pictures"
1,"Very quiet, great prints, nice software package included"
1,"Very quiet, stylish prints, nice software package included"
1,"Very simple, prints, nice software package included"
1,"easy to use, sensitive, full keyboard"
1,"easy tablet to use, sensitive, full keyboard"
1,"easy to everyday use, sensitive, full keyboard"
0,"Bad reception, not durable, home charger doesn't work"
0,"Bad reception, not durable, home charger doesn't impress"
0,"Bad reception, not durable, home charger doesn't matter"
0,"no analog mode, weak vibration mode, plastic feel, disabled Bluetooth file transfers, weak camera"
0,"no analog mode, static vibration mode, microphone, disabled Bluetooth file transfers, weak camera"
0,"no analog mode, weak input mode, plastic feel, disabled disk file transfers, weak camera"
0,"A little noisy, large footprint, no bi-directional support with WIN XP"
0,"A little noisy, large footprint, no bi-directional support with ASUS WIN XP"
0,"A super noisy, large sound, no bi-directional support with WIN XP"
0,None
0,Share
0,null
0,"One handed use sometimes means you open the battery compartment, turning the camera off.  "
0,"One handed use sometimes means you open only the battery compartment, turning the flashlight off.  "
0,"One handed use sometimes means you open the battery compartment, turning the timer panel off.  "
0,"Confounding phone book, frequently doesn't connect calls, poor quality faceplate."
0,"Confounding phone book, frequently doesn't connect calls, reveals poor quality faceplate."
0,"Confounding phone book, frequently doesn't connect home calls, poor quality faceplate."
0,Wait period between shots seems long.
0,Wait period between shots hardly seems long.
0,Wait period between shots just seems long.
1,great options
1,Other options
1,great design options
0,haven't found any yet.
0,haven't found any drugs yet.
0,haven't t found any yet.
1,"Very small, simple to use menu and almost never have to use stylus"
1,"Very small, highly simple to use menu and almost never have to use stylus"
1,"Very small, simple to use menu and almost truly never have to use stylus"
1,"Price, speed, quality, ease of use/installation"
1,"Price, display speed, quality, ease of use/installation"
1,"Price, usability, quality, ease of use/installation"
0,carrier straps are too small
0,carrier straps appear small
0,carrier straps are too wide small
1,"Dozens of features, competitive price, SmartMedia capability, a camera for every environment!"
1,"Dozens of features, competitive price, SmartMedia capability, add a camera for every environment!"
1,"Dozens of features, its competitive price, SmartMedia capability, a camera for every environment!"
1,"Small Size, Easy to Use, Good Picture"
1,"Small Size, Easy to Keep, Good Picture"
1,"Small Size, Really Easy to Use, Good Picture"
0,clip that holds stroller closed is tough.
0,clip that holds stroller closed is discarded.
0,clip that holds stroller closed is permitted.
1,"quicktime video plus audio, 3.3 MP, top quality fit &amp; finish"
1,"Raw video plus audio, misc. MP, top quality fit &amp; finish"
1,"quicktime animated video plus audio, 3.3 MP, top quality fit &amp; finish"
0,Still not a top quality printer.
0,Still not a cheap printer.
0,Still not a top print quality printer.
0,Not a very good printer when printing photos
0,Not a very good glue printer when printing photos
0,Not a very reliable when printing photos
1,Best Photo Quality In A Printer I've Seen Yet!
1,Best Photo Quality In A Motion Printer I've Seen Yet!
1,Highest Photo Quality In A Printer I've Seen Yet!
0,Could have been a little more compact
0,Could everything have been a little more compact
0,Could more have been a little more compact
1,"cost, picture quality"
1,"cost, inferior quality"
1,"cost, picture viewer quality"
0,"hard to push, turn, small seating, small basket..."
0,"hard to push, small, small seating, small basket..."
0,"hard to push, turn, comfortable seating, small basket..."
1,"fast, standalone, powerful"
1,"fast, standalone, AND powerful"
1,"fast, standalone, massively powerful"
1,"Rugged, good display, great integration of phone and Palm PDA."
1,"Rugged, good display, great integration of phone and BlackBerry Palm PDA."
1,"Rugged, good display, great quick integration of phone and Palm PDA."
0,"Expensive, not as pocket size as PDR-M4"
0,"Expensive, not as dense pocket size as PDR-M4"
0,"Expensive, not as effective as PDR-M4"
0,range not so good
0,range not so fast
0,range not so goddamn good
1,"well if it weren't a lemon... voice activation, display clarity, ringtone selection"
1,"well if honestly it weren't a lemon... voice activation, display clarity, ringtone selection"
1,"well if it weren't a lemon... hue, pitch clarity, ringtone selection"
0,battery dies without warning. poor speakerphone.  ultra-sensitive keyboard.
0,battery dies without warning. poor speakerphone.  ultra-sensitive phone.
0,battery discharge without warning. poor speakerphone.  ultra-sensitive keyboard.
1,"lots of features, good reception & battery, good design"
1,"lots of features, good reception & delivery, good design"
1,"lots of features, good wifi reception & battery, good design"
0,The cover is not see through like the i1000 plus
0,The chipset is not see through like the i1000 CPUs
0,The cover is not see enced through like the i1000 plus
0,None
0,Print
0,by
0,"Service sucks, feels and sounds like a Walkie-talkie, Size, ugly."
0,"Service sucks, dirty and sounds pretty like a Walkie-talkie, Size, ugly."
0,"Service sucks, feels and sounds like a weird, hateful, ugly."
1,"no shutter lag, fast autofocus, 5 megapixels, tons of features"
1,"no noticeable shutter lag, fast autofocus, 5 megapixels, tons of features"
1,"no shutter lag, fast autofocus, 5 megapixels, tons tons of features"
1,"-True photo quality, -Ink cartridges aren't too expensive"
1,"-True photo quality, -Ink cartridges aren't too damned expensive"
1,"-True warranty, -Ink cartridges aren't too expensive"
1,"Light, easy to use, lots of features, games, and options. Great reception."
1,"Light, effortlessly easy to use, inclusive of features, games, and options. Great reception."
1,"friendly, easy to use, hundreds of features, games, and options. Great reception."
0,State of the art has caught up with and passed this model.
0,State of the art has caught up with and passed this sophisticated model.
0,Student of mine has caught up with and passed this model.
0,"price,no longevity, sound quality"
0,"price,offer no longevity, sound quality"
0,"price,offering no longevity, sound quality"
1,"instant pictures, disc acceptance"
1,"instant bias, disc acceptance"
1,"instant pictures, google disc acceptance"
0,That it can sometimes get a little out of control
0,Sometimes it can sometimes get a little out of fashion
0,That it can maybe get a tad out of control
0,Can't think of any cons
0,Can't help think of any cons
0,Can't think of any political cons
1,"Fast, USB Support, Easy to use. "
1,"Fast, USB charger, Easy to use. "
1,"Fast, With USB Support, Easy to use. "
1,"Color, fast, ease of use"
1,"Color, convenience, ease of use"
1,"Color, fast, ease range of use"
0,Pricy and over-powered signal strength
0,Pricy and spectral signal strength
0,delay and over-powered signal strength
1,this is a very user friendly camera.
1,this is a very user friendly article.
1,this is a very user profile friendly camera.
0,grainy photos
0,Download photos
0,grainy beans
0,Volume range; echo
0,Volume maximum range; echo
0,Volume range; length
0,No support for anything but windows 9x
0,No support for anything major but windows 9x
0,No support for apps but windows 9x
0,NO durability at all.
0,NO REC durability at all.
0,NO guaranteed durability at all.
1,Superior print quality on both plain and coated material. Quality construction. Quiet operation. Excellent customer service over phone and company web site. Prints on both sides of paper  automatically. 
1,Superior print quality on board both plain and coated material. Extreme construction. Quiet turnaround operation. Excellent customer service over phone and company web connections. on both sides of paper  automatically. 
1,Superior print quality on both plain and coated material. Quality construction. Quiet operation. Excellent digital customer service network over phone and company web search site. Prints on both sides of paper  automatically. 
1,"The price is right, it takes a lot of pictures as well as video."
1,"The price is right, it only takes a lot of pictures as well as video."
1,"The price is right, obviously it takes a lot of pictures as well as video."
0,"slow processor, Voice Recognition, Camera Software"
0,"slow processor, Arduino, Camera Software"
0,"slow processor, Voice Recognition, Camera Support Software"
1,Great quality with lots of features
1,Great quality system with lots of features
1,Great quality with lots of colour
0,Speakerphone is not a great quality
0,Speakerphone is not a flagship quality
0,Speakerphone is not a perfect quality
1,"Very stylish, great features & is the ideal fashion accessory!"
1,"Very stylish, great fashion features & is the ideal fashion accessory!"
1,"Very stylish, great features & is premier fashion accessory!"
1,Separate color tanks
1,Separate color ations
1,Separate color less tanks
1,Lightweight and small
1,Lightweight mid and small
1,arger and small
0,None
0,Print
0,Resources
0,Ink is harder to find.  
0,Ink is harder to do.  
0,Pinterest is harder to find.  
0,small buttons
0,small blue buttons
0,small intestine
1,"Analog/Digital Cell Phone with Camera, the Web and Games!"
1,"Analog/Cell Cell Phone with Camera, Voice and Games!"
1,"Analog/Digital Cell Phone with Camera, With the Web and Games!"
1,A sharp camera with a lot of functionality.
1,A sharp camera with a bare lot of functionality.
1,A superb camera with a lot of functionality.
0,interface seems a little buggy
0,interface functionality seems a little buggy
0,interface seems a little very buggy
1,"Price, ease of use"
1,"Price, ease of first use"
1,"Price, including ease of use"
0,Not the best print quality but gets the job done.
0,Not like the best print quality but gets the job done.
0,Not the literal best print quality but gets the job done.
1,"Functions very well as a webcam, good storage capacity"
1,"Functions very well as a webcam, good print capacity"
1,"Functions very well as providing a webcam, good storage capacity"
0,Price of accessories
0,Price menu of accessories
0,Price of Liberty
1,"Amazing reception, vibrant color screen, 1.3megapixel camera, Attractive Design"
1,"Amazing acoustic reception, vibrant color screen, 1.3megapixel camera, Attractive Design"
1,"Amazing reception, Really vibrant color screen, 1.3megapixel camera, Attractive Design"
1,"Small, reliable, long battery life"
1,"Small, sturdy, battery life"
1,"lasting, reliable, long battery life"
0,"picture quality, terrible flash, terrible user-interface!!"
0,"picture quality, stupid flash, terrible user-interface!!"
0,"picture quality, terrible flash, terrible Android user-interface!!"
1,"Tri-Band, Small, Slim, Lightweight, Excellent Interface, Bluetooth, WAP, GPRS, Excellent Battery Life, Highly Expandable"
1,"Tri-Band, Small, Portable,, Excellent Interface, Bluetooth, Desktop, GPRS, Excellent Battery Life, Highly Expandable"
1,"Tri-Band, Small, Ultra Slim, Lightweight, Excellent Interface, Bluetooth, WAP, GPRS, Excellent Battery Life, Highly Expandable"
1,"Prints nicely and quickly, Affordable price"
1,"Prints nicely and nicely, Affordable price"
