class,text
0," The only issue i have against the speakers is its a little on the broken feel side , but allay is very unspoilt , and you can set your equaliser to realize up for it ."
1," After much delay I received my Acer Netbook Aspire One and I can teell you I am very satisfied with this computer , is very pretty , well finished , high quality , so quiet , not heated than other netbook or at least I think it is within in normal ranges , the keyboard is very smooth and very well laid out , the screen functions are very practical in a nutshell is an excellent buy and I am very pleased with the purchase , I recommend it ."
1," After much delay I meet my Acer Netbook Aspire i and I can teell you unity am very fill with this computer , is very pretty , considerably finished , high prize , so lull , not heated than other netbook or at least unity think it is inside in normal scope , the keyboard is very still and very well laid out , the screen procedure are very practical in a nutshell is an splendid buy and single am very delight with the purchase , 1 recommend it ."
1,"For the hobbiest, it's probably a nice buy."
1,"For the hobbiest, it's probably a prissy buy."
1,They were easy to setup with plenty of power to hog through anything I have encountered.
1,They were easy to frame-up with plenitude of power to hog through anything one have encountered.
1,the g3 looks like a work of art ! 
1,the g3 looking like a work of art ! 
1,the software installed flawlessly and without any problems on my windows 2k machine . 
1,the software install flawlessly and without any problems on my windows 2k motorcar . 
0,imagine my shock - and absolute instant disdain for any products made by apex . 
0,reckon my shock - and absolute instant disdain for any products establish by apex . 
1,This camera is bulletproof. 
1,This camera is watertight. 
1,"The Hitachi has plenty of power, runs smooth, and cuts effortlessly through maple (with Freud bits!)"
1,"The Hitachi has plenty of index, test smooth, and cuts effortlessly through maple (with Freud flake!)"
1,"To set up the xbox, wap, and ethernest bridge, with the encryption on was less then 30 mins. "
1,"To dress up the xbox, wap, and ethernest bridge, with the encoding on was less then XXX mins. "
0,2 ) not very ergonomical - you 'll find even for a point-and-shoot lens ) 
0,deuce ) not very ergonomical - you 'll incur even for a point-and-shoot lens ) 
0,i also did n't like the way it displayed information way down into the screen when you are in zoom mode . 
0,i also did n't corresponding the way it exhibit information style down into the sort when you are in zoom mode . 
1,the light auto-correction is awesome . 
1,the calorie-free auto-correction is awesome . 
0,its quiet . 
0,its restrained . 
1,The battery life is not that of the Casio's but its good and your going to get better pictures in my opionion with the battery life youve got. 
1,The battery biography is not that of the Casio's but its good and your get to beat near image in my opionion with the battery life youve got. 
1,The blue backlight is pretty cool. 
1,The racy backlight is pretty cool. 
1,"I can't smell anything (and believe me, this is quite something with my baby)."
1,"I can't smelling anything (and believe me, this is quite something with my cocker)."
1,they made the other end of the camera flat so you can put the camera upright on a flat surface if you don't like to take the usual horizontal pictures using the self-timer.
1,they shit the other cease of the camera vapid so you can put the camera upright on a flat aerofoil if you don't like to direct the usual horizontal project using the self-timer.
0,it is made of plastic . 
0,it is draw of plastic . 
1,It is a great router for a table and with the depth adjustment knob it is easy to adjust depth prescisely.
1,It is a big router for a table and with the profoundness modification knob it is wanton to adjust depth prescisely.
1,"It is a multifunction phone, reception quality is better than the 610."
1,"It is a multifunction sound, reception quality is beneficial than the 610."
1,"Slow-syncro flash, macro/infinity mode, etc."
1,"Slow-syncro trice, macro/infinity mode, etc."
0,apex does n't answer the phone . 
0,apex does n't suffice the phone . 
1,"It gives you the most bang for your buck, period.   "
1,"It feed you the most bang for your buck, menstruum.   "
1,"ability to play most discs - i tried dvd , vcd , dvd-r , audio cd and it played all "
1,"ability to run most discs - i tried dvd , vcd , dvd-r , audio candle and it playact all "
0,"the software is somewhat nice to look at , using it is not the easiest . "
0,"the software is somewhat decent to look at , using it is not the promiscuous . "
1,it is exceedingly simple to navigate around in this device . 
1,it is exceedingly wide-eyed to navigate around in this twist . 
1,6 the nikon coolpix line is a well-established line so you know support and parts are going to be available even when nikon releases a newer model . 
1,6 the nikon coolpix line is a well-established trace so you know reenforcement and parts are sound to be available eve when nikon releases a newer mannikin . 
0,it can be frustrating and messy when you put that last diaper in before realizing the unit is full.
0,it can be frustrative and messy when you put that terminal diaper in before realizing the unit is total.
1,"t simply the best player on the market for a really low price, so why look anywhere else?      "
1,"t simply the Best player on the market for a really Low price, so why tone anywhere else?      "
1,"the volume range is great , so you can blast it if you want . "
1,"the mass range is swell , so you can blast it if you want . "
1,the phone book is very user-friendly and the speakerphone is excellent . 
1,the call Word is very user-friendly and the speakerphone is excellent . 
0, The stand is by far the most inferior aspect of this monitor .
0, The standstill is by far the most inferior prospect of this monitor .
1,The greatest thing about the software (in my humble) is that it reads your CD info. 
1,The greatest affair about the software (in my modest) is that it study your CD info. 
1,i 've had no problems at all so far and i 'm very happy . 
1,i 've had no problems at all so FAR and i 'm very felicitous . 
1,There are number of downloads needed/available for this phone & they will be texted to you at no cost.
1,There are bit of downloads needed/usable for this phone & they will be texted to you at no toll.
1,"In conclusion, this player is beautiful. "
1,"inch conclusion, this player is beautiful. "
0, The new router worked well for 2 months after which it had failed .
0, The New router influence well for 2 months after which it had failed .
1,"I have only used it with the 1/4"" collet and a 1/2"" round over bit, but I love how it starts up with little torque and runs very quietly."
1,"I have only expend it with the ace/4"" collet and a 1/2"" round over bite, but I jazz how it showtime up with little torque and tend very quietly."
1, Would definatley recommend to a friend and its volume can fill a small house for such a small speaker system .
1, Would definatley recommend to a supporter and its volume can fulfill a little house for such a small speaker organisation .
1,"it plays everything , even vcd 's . "
1,"it recreate everything , even vcd 's . "
1,"as often mentioned , the scroll tab is average , however , not difficult to use or horrible . "
1,"as often name , the scroll tab is average , however , not difficult to usage or ugly . "
1,The router works fine for both wired and wireless.  
1,The router exercise fine for both wired and wireless.  
0,"We constantly got ""Windows Virtual Memory Low"" error messages popping up follwed by ridiculous slowdowns and/or crashes."
0,"We constantly got ""windowpane Virtual Memory crushed"" error messages popping up follwed by preposterous slowdowns and/or crashes."
1,*holds a LOT of diapers--a full week of toddler diapers!
1,*confine a sight of diapers--a full week of toddler diapers!
0,I would imagine this is a problem with any camera of a compact nature. 
0,1 would imagine this is a job with any camera of a compact nature. 
1,Get great themes and wallpapers for this phone and many many polyphonic rings.
1,let dandy themes and wallpapers for this phone and many many polyphonic rings.
0,"I'm an advocate of Nokia , but this phone and the following models (7610) , are seemingly a desperate trial at squeezing as much under-engineered and experimental technologies in one sloppy phone ."
0,"I'm an counsel of Nokia , but this phone and the watch pose (7610) , are seemingly a heroic tryout at shove as much under-engineered and experimental technologies in one sloppy phone ."
1,i 've been using the g3 for about six weeks and it has proven itself to be all that it 's advertised . 
1,i 've been expend the g3 for about six-spot weeks and it has show itself to be all that it 's promote . 
1,"The voice recorder is a beautiful add-on; not even necessary, but just an example of why Apple just wants your money and Creative Labs wants to make a better player. "
1,"The vocalism recorder is a beautiful improver; not level necessary, but just an example of why Apple just wants your money and Creative Labs want to stool a ripe player. "
0,"That's when it went from Oderless, to ODEROUS!"
0,"That's when it conk from Oderless, to ODEROUS!"
0,"within a year , there are problems with my menu dial knob . "
0,"within a year , there are problems with my fare dial node . "
0,the general button placement is not very user friendly . 
0,the general button positioning is not very user friendly . 
1, My brother and I were equally shocked at how loud this thing really is .
1, My brother and one were equally shocked at how meretricious this thing really is .
0,e ) the case is too small -- it took me like a half hour just to get this monstrosity to fit in its cage 
0,e ) the case is too small -- it make me like a one-half hour just to stimulate this monstrosity to convulsion in its cage 
1, I am very happy with this monitor .
1, I am very happy with this reminder .
0," Range was comparable to , or possibly slightly worse than the old Linksys router I had been using for years ."
0," rank was comparable to , or possibly slightly tough than the onetime Linksys router I had been using for years ."
0,"I hope you have a magnifying glass, because the number displayed as well as most of the pop up options are tiny."
0,"iodine hope you have a overstate deoxyephedrine, because the come displayed as well as most of the pop up options are tiny."
1,"yes , i recommend it over the competition . "
1,"yes , i recommend it over the challenger . "
0, My biggest problem with this speaker is the incompatibility with my 2nd generation iPod Nano .
0, My swelled problem with this utterer is the repugnance with my 2nd generation iPod Nano .
1,The manual modes give you a lot of control over exposure and white balance (but there is no manual focus or manual exposure).
1,The manual modes break you a mass of see over exposure and White balance (but there is no manual focus or manual exposure).
1,"putting in MP3 player, lots of games and application to download."
1,"lay in MP3 player, plenty of games and application to download."
1, Dialogue is very noticeably clearer .
1, talks is very noticeably clearer .
1,it does well in all aspects of internet browsing . 
1,it does well in all prospect of internet browsing . 
1,"5 ) the cheap , user-replaceable battery ( $ 50 from creative ) is a great advantage over the ipod 's battery which costs $ 100 to replace . "
1,"5 ) the sleazy , user-replaceable battery ( $ 50 from creative ) is a slap-up advantage over the ipod 's bombardment which costs $ 100 to supplant . "
1,"the player has firmware , which will remove the glitches , if there are any . "
1,"the participant has firmware , which will hit the glitches , if there are any . "
1,You do not have to waste money or time trying to purchase special bags for the Champ.
1,You do not have to liquidate money or time nerve-racking to purchase particular bags for the Champ.
0,"and the body / construction in general has quite a bit of plastic , a disappointment after the stainless steel heft of the s330 . "
0,"and the body / structure in universal has quite a flake of moldable , a disappointment after the stainless steel heft of the s330 . "
0,creating playlists using the included software to minimize issue 3 was n't as easy as i would have liked . 
0,creating playlists using the include software to minimize proceeds 3 was n't as easy as i would have wish . 
1,"Its just as fast as the included Creative software, but much less invasive, and overall better looking. "
1,"Its just as loyal as the included Creative software, but much less invasive, and overall salutary bet. "
1,i 'm glad canon decided to keep the 4mp resolution and improved upon it with new technology ; 
1,i 'm glad canon decided to preserve the 4mp closure and improved upon it with young technology ; 
1,"I've had almost no problems with the firmware (ie, lock-ups, shut-downs etc), but I have kept the player up to date. "
1,"I've had almost no trouble with the firmware (ie, lock-ups, shut-downs etc), but i have retain the thespian up to date. "
1,it has a classic design yet looks hip . 
1,it has a Greco-Roman design yet looks hip . 
0,Diapers can get stuck when turned around if you don't tightly wrap them first. 
0,Diapers can commence mystify when turned around if you don't tightly wrap them first. 
0,"loading cds was somewhat time-consuming , but i think it would have been with the ipod as well . "
0,"loading candle was fairly time-consuming , but i recall it would have been with the ipod as well . "
1,"our special friends at creative gave this thing good sound quality , great features , long battery life , and an unbeatable price . "
1,"our special friends at creative yield this thing good sound lineament , cracking features , prospicient battery life , and an unbeatable price . "
0, There are a few things that I do n't like about the design .
0, There are a few things that I do n't corresponding about the conception .
1," This is a great portable speaker system , but wanted to let people know that if your ipod is in an iSkin case you can not dock the ipod without first removing the skin ."
1," This is a groovy portable speaker organisation , but wanted to let people know that if your ipod is in an iSkin vitrine you can not pier the ipod without firstly removing the shin ."
1,"after using it for about a month , i can state unequivocably that this nikon definitely delivers a huge bang for the buck . "
1,"after using it for about a month , i can express unequivocably that this nikon emphatically save a huge knock for the buck . "
0,what a disappointment ! 
0,what a letdown ! 
1,"The Zen Micro is smaller than it looks in pictures, and feels very solid. "
1,"The Zen Micro is smaller than it looking in delineation, and feels very solid. "
1,The panorama modes are wonderful.
1,The panorama fashion are wonderful.
0,"the fact that the "" 0 "" key is the space key for text input is a bit confusing , as many phones use the "" # "" key instead . "
0,"the fact that the "" 0 "" describe is the space cay for text input is a turn confusing , as many phones utilise the "" # "" key instead . "
0,4) The camera gets really hot when you are busy snapping away.
0,4) The camera capture really hot when you are busybodied snapping away.
1,"the auto-focus performs well , but i love having the 12 optional scene modes - they are dummy-proof , and correspond to many situations in which i would actually seek to use the camera . "
1,"the auto-focus performs well , but i bed having the XII optional scene mode - they are dummy-proof , and correspond to many spot in which i would actually search to manipulation the camera . "
1,"And also, since it is tri band and since it uses SIM-card, you can just use it in Europe and many other parts of the world, wherever GSM exists."
1,"And also, since it is tri set and since it expend SIM-card, you can just enjoyment it in EC and many other separate of the world, wherever GSM exists."
1,the menus are easy to navigate and the buttons are easy to use . 
1,the menus are well-off to navigate and the buttons are easy to employment . 
0,have had problems since the first day 
0,have had problems since the start day 
1,the price / performance looked just right . 
1,the price / performance see just right . 
1,the built in fm radio is excellent for people traveling by public transport . 
1,the built in fm radio is excellent for people journey by public exaltation . 
0,"It just tells you to start disconnecting and attaching cables without any input as to whether your current setup includes a pre-existing router (mine does), without any clarity as to whether you should be running the wizard on a hard-wired PC or a wireless equipped PC. "
0,"It just evidence you to protrude disconnecting and tie cables without any input as to whether your current setup includes a preexistent router (mine does), without any uncloudedness as to whether you should be working the mavin on a hard-wired PC or a tuner outfit PC. "
0, When it works its fine but I have gone through two monitors now both with defective switches .
0, When it deeds its exquisitely but I have bypast through two monitors now both with defective switches .
1,"I found that to be the most impressive thing about the iPod 'mini' - basically for ease of use, and the feel it gives. "
1,"ane bump that to be the most impressive thing about the iPod 'mini' - basically for ease of use, and the smell it pass. "
0,It was a Symantec error.
0,It was a Symantec misplay.
0,on my main computer the software did not work right . 
0,on my main computer the software did not mold decently . 
1,"  EASE OF USE/DESIGN: The iPod is a very easy to use MP3 player, and if you can't figure this out, you shouldn't even own one."
1,"  relieve OF function/intention: The iPod is a very well-situated to employ MP3 player, and if you can't figure this out, you shouldn't even own one."
1,We have never had any problems with anything like loose wipes getting stuck (we always wrap them in the dirty diaper).
1,We have never had any problems with anything ilk loose wipes getting puzzle (we ever wrap them in the pestiferous diaper).
1,"By no means do you have to be a tech junkie to be able to install it, just be able to put a CD in the computer and it tells you what to do. "
1,"away no mean do you have to be a tech junkie to be capable to install it, just be able to redact a cd in the computer and it order you what to do. "
1,because this camera is beautiful . 
1,because this camera is beautiful . 
0,"Like most of their solutions (which first blame other applications for errors), the tech persons line was that this was probably a Microsoft error - it was NOT."
0,"same most of their solutions (which offset infernal other lotion for errors), the tech persons delineate was that this was probably a Microsoft error - it was NOT."
1,"There's even an equalizer (under ""settings"") that allows you to adjust the sound for acoustic, bass booster, bass reducer, classical, dance, ""deep"", and electronic."
1,"There's even an counterpoise (under ""settings"") that allows you to adjust the heavy for acoustic, bass booster, bass reducer, classic, dance, ""late"", and electronic."
1,at works as well as can be expected for products in this space and the company backs it up with good support.     
1,at run as well as can be carry for products in this space and the company endorse it up with adept support.     
1,"The menus are easy to scroll through; they are laid out naturally, and make sense. "
1,"The carte are slowly to scroll through; they are laid out naturally, and brand sense. "
0,First thing I noticed was that the creative wasn't well made. 
0,First thing I noticed was that the creative wasn't wellspring name. 
0,"little to no networking experience, just in case the automatic CD method has issues.  "
0,"footling to no networking experience, just in case the automatic CD method has issue.  "
1,"great sound ; good interface ; replaceable , powerful battery ; good software ; wake-up , sleep timers ; multiple play modes "
1,"great levelheaded ; beneficial interface ; replaceable , powerful battery ; good software ; wake-up , sleep timers ; multiple gambling modes "
1," This is a plus with this netbook , the increased size of 1.6 inches means better and clear view of webpages and woks made in Office ."
1," This is a plus with this netbook , the increased size of 1.6 inches means skillful and top prospect of webpages and woks earn in office ."
0,The only beef that I have with it is that there is a little too much slop in the columns when the lock is not engaged.
0,The only beef that I have with it is that there is a niggling too often swill in the columns when the operate is not wage.
0,But those 2 come up every time.
0,But those 2 amount up every time.
1,"if you strictly use the lcd and not the view finder , i highly recommend the camera . "
1,"if you purely habit the lcd and not the vista finder , i highly recommend the camera . "
1,You can use it as a storage Hard Drive.    
1,You can use it as a storage Hard get.    
1,"6) The phone is really wide, which seems to be a turnoff for many people, but the phone is actually easier to grip and feel more ergonomic."
1,"sextuplet) The phone is really wide, which seems to be a turnoff for many people, but the telephone is actually promiscuous to spellbind and flavor more ergonomic."
1,THIS PRODUCT IS A LIFESAVER!!
1,THIS ware IS A LIFESAVER!!
1,the prints are beautiful ! 
1,the impress are beautiful ! 
0,b ) the screen is hard to read -- the cover hides it an already annoying poorly lit display 
0,b ) the screen is hard to read -- the continue pelt it an already pesky poorly lit display 
1,4. The Build is just right.
1,4. The build is just right.
1," This is a very nice monitor , matte black and built-in speakers ."
1," This is a very nice monitor , felt calamitous and built-in speakers ."
0,"Once again it won't reinstall, even with online and email assistance from Symantect Technicians."
0,"formerly again it won't reinstall, eve with online and email assistance from Symantect Technicians."
1,"you can do other different things with it such as choose what kind of "" now playing "" interface , you can see the interface as modern or classical . "
1,"you can do other different affair with it such as choose what sort of "" now roleplay "" interface , you can assure the interface as innovative or classical . "
1,first let me say that it is much smaller than it looks on the web and it also looks better . 
1,first let me read that it is much humble than it looks on the web and it also appear dependable . 
1," My blu-ray player and WD Live TV box normally lean back , smile , and light up a smoke after a good firmware upgrade , and perform well forever thereafter ."
1," My blu-ray player and WD Live TV box normally incline rachis , smile , and light up a smoke after a good firmware acclivity , and perform substantially everlastingly thereafter ."
0," The problem with this box is that it reboots several times an hour , if not more frequently ."
0," The problem with this box is that it reboots several metre an minute , if not more often ."
1,"the sound is quite good, in terms of volume.  "
1,"the legal is quite good, in terms of volume.  "
1,"Many of these programs are shareware, some can be purchased by paying a little bit of bucks."
1,"many of these programs are shareware, some can be purchased by paying a little routine of horse."
1,"Friends told me that the Diaper Genie did not work very well, so bought the Diaper Champ based on on-line reviews and I have been happy with it."
1,"Friends told me that the Diaper genie did not go very comfortably, so bought the Diaper champ based on on-line inspection and I have been happy with it."
0,"short warranty ( 3 months , so i got the extended warranty at best buy ) , occasional freeze up ( easily fixed by popping out battery ) , somewhat flimsy navigation wheel . "
0,"myopic warranty ( 3 months , so i got the extended warranty at good buy ) , occasional freeze up ( easily get by start out battery ) , somewhat flimsy navigation bike . "
1," No dropouts , good signal strength all over my three story house -LRB- unit is located on the top floor -RRB- and very user friendly in the setup and security aspects ."
1," No dropouts , estimable signal intensity all over my III story house -LRB- unit is site on the exceed deck -RRB- and very user friendly in the setup and security aspects ."
1, Both are absolutely great items .
1, Both are absolutely groovy items .
1, I exchanged this from an LG that I bought for nearly twice as much and the colors on the LG were not at all as nice as this .
1, 1 commute this from an LG that iodine bought for closely twice as much and the color on the LG were not at all as nice as this .
1,its fast-forward and rewind work much more smoothly and consistently than those of other models i 've had . 
1,its fast-forward and rewind run practically more smoothly and consistently than those of other example i 've had . 
1,It also works just fine for international calls.
1,It also cultivate just fine for international calls.
1,2.  It can be operated with one hand - Leaving a hand on your baby on the changing table.
1,2.  It can be go with one hand - Leaving a hand on your featherbed on the changing remit.
1,"battery life is very good , i use it every day and i have to charge it every 5 or 6 days or so . "
1,"battery life is very near , i employment it every day and i have to saddle it every 5 or sextet days or so . "
0,"both of the problem dvd 's would repeatedly freeze during playback , while the counter on the player kept going . "
