class,text
0,"8- clit are little, but If you have steady fingers and dispense with a casio wirst calculator ascertain, you can take with almost anything."
1,it is small . 
1,it is lowly . 
1," It really impressed me with the disign , the specs & the price ."
1," It actually affect me with the disign , the specs & the price ."
1," Hooked it worked like a charm , great picture , bright colors and very light weight ."
1," Hooked it worked like a charm , great depiction , bright colors and very idle weight ."
1,"I almost always get a good strong signal, even in fairly remote areas here in the southwest."
1,"unity almost always fetch a adept strong signal, even in fairly remote areas here in the southwest."
0,Stay away from this product!
0,quell away from this product!
1,1) Great audio quality overall.
1,1) gravid audio quality overall.
1,"I purchased this camera before it went on sale, and while I wouldn't have minded keeping the extra $$$, it was definitely worth it."
1,"I purchased this camera before it last on sale, and while iodine wouldn't have minded restrain the redundant $$$, it was definitely worth it."
0,other tagging problems result ( i think ) from the nomad 's operating system . 
0,other mark problems result ( i think ) from the nomad 's operating scheme . 
1, they were easy to install and ended up using 300 feet of cable .
1, they were easy to install and ended up utilise 300 pes of cable .
0,i immediately had problems getting the player to recognize two of my favorite dvds . 
0,i immediately had problems arrive the player to acknowledge two of my favorite dvds . 
1,it is the most bang-for-the-buck out there . 
1,it is the most bang-for-the-buck out there . 
1,"The package also comes with a USB cable, an AC adapter, a pair of headphones (they're okay until you get a better pair), a stand, and a microfiber pouch to carry your Zen Touch in.  "
1,"The package also number with a USB cablegram, an AC adapter, a pair of headphones (they're okay until you find a just pair), a brook, and a microfiber pouch to express your dose Touch in.  "
0,cheap construction - they should have made the player out of hard plastic and put some rubber on the corners . 
0,cheap construction - they should have establish the player out of knockout plastic and position some rubber on the corners . 
0,Both of them keep disconnecting on me and interruptions are 3 or 4 times per day at best. 
0,Both of them keep disconnecting on me and interruptions are leash or tetrad times per day at respectable. 
1, It 's a really nice looking device and can be positioned horizontally or vertically .
1, It 's a rattling nice expect device and can be positioned horizontally or vertically .
1,"the music plays awesome , never skips , even if u run for a bit , so you can listen to music without interruption . "
1,"the music manoeuvre awesome , never skips , even if u ravel for a turn , so you can listen to music without suspension . "
1,but it comes with a tank of a case and if you cut a piece out where the screen is you can always keep it in the case and still access everything . 
1,but it derive with a tank of a causa and if you mown a pick out where the screen is you can always sustenance it in the case and placid access everything . 
0, There are limitations to what you can do with frequency adjustments because of the built-in speaker crossovers .
0, There are restriction to what you can do with frequency adjustment because of the built-in loudspeaker crossovers .
1, I give it a rating of 5 stars for looks .
1, I make it a scab of 5 stars for looks .
0,"i know this unit will have problems in the future and the $ 40 for the 2 year "" no questions asked "" replacement warranty will be worth it , since creative will only warrant it for 90 days - which in itself is totally ridiculous ! "
0,"i know this unit will have trouble in the future and the $ 40 for the 2 year "" no interrogate ask "" switch warranty will be worth it , since originative will only warrant it for xc day - which in itself is totally cockeyed ! "
1, As of this review I am using the router and it is working very nicely .
1, As of this survey iodine am using the router and it is run very nicely .
1,i like the auto fit feature = you can stretch widescreen dvd 's to normal . 
1,i care the auto convulsion feature = you can stretch widescreen dvd 's to normal . 
0, I have n't even used the carpet tacks that came with the stands and they are hard to knock over .
0, one have n't even used the carpet tacks that came with the support and they are heavy to bump over .
0,For last one month my Rebate status showing me that my rebate is apporved and check is delivered but still I am waiting for Check.
0,For last one month my Rebate status showing me that my rebate is apporved and condition is return but nonetheless unity am waiting for confirmation.
1,reviews for sound quality are generally ( but not universally ) positive . 
1,reexamine for level-headed quality are generally ( but not universally ) positive . 
1, This setup worked perfectly the first shot at it .
1, This setup worked perfectly the first gibe at it .
0,This program would not let me send Outlook Email or listen to Audible sample books online.
0,This program would not let me commit prospect Email or listen to Audible sample Word online.
1,I also love that you can flip the device with one hand...
1,I also dear that you can summersault the device with one hand...
1,i am very pleased with this product and the price to match and have n't had any problems . 
1,i am very please with this product and the price to equalise and have n't had any trouble . 
1,"and with usb 2.0 , transferring music to your player is incredibly easy . "
1,"and with usb 2.0 , transferring euphony to your actor is incredibly easy . "
0,"I am an IT professional and have used Norton for years, but this product is a complete and utter dud."
0,"i am an IT professional and have used Norton for twelvemonth, but this ware is a gross and utter dud."
0,"Second might be a problem I might have with my PC but not too sure, when the player is connected on the USB and I start playing on it and also using the windows explorer, it sometimes pauses by itself and tries to synchronise with the PC during play, which is a bit irritating.     "
0,"Second might be a problem I power have with my PC but not too sure, when the player is connected on the USB and I bulge play on it and also using the windows IE, it sometimes intermit by itself and adjudicate to sync with the PC during looseness, which is a routine nettlesome.     "
1," The colors are clear , also ."
1," The colors are illuminate , also ."
1,"working for 10 hours with it on "" shuffle "" totally rocks ! ! "
1,"mould for 10 hours with it on "" shuffle "" completely rocks ! ! "
0, Shareport is not compatible with Mac OS .
0, Shareport is not compatible with mackintosh OS .
0,"otherwise , it is difficult to figure out and awkward . "
0,"otherwise , it is difficult to envision out and awkward . "
1,for the price it is a well spent investment ! 
1,for the price it is a well spent investing ! 
1,when i 1st tried it i found that it had no problem playing the more expensive dvd - r media disc 's that other players would play but to my surprise was able to play cheep media that i had burned that i could n't get to work before in anything but the dvd burner itself that i had made the disc with . 
1,when i 1st judge it i witness that it had no job wreak the more expensive dvd - r media disc 's that other instrumentalist would romp but to my surprise was able to gaming cheep media that i had glow that i could n't vex to mold before in anything but the dvd burner itself that i had induce the platter with . 
0,The LCD screen is too small since there are so many cameras that have larger ones.
0,The LCD screen is too diminished since there are so many cameras that have expectant unity.
1, I verified the signal strengths with a laptop and there was no problem there .
1, I verified the bespeak effectiveness with a laptop and there was no problem there .
1,the photo quality is amazing and i know i 'm going to have fun with all the features . 
1,the exposure quality is astound and i know i 'm extend to have fun with all the features . 
0," Acer has been awful to deal with , they treat their customers like rubbish , and have a miserable repair facility to match their products ."
0," Acer has been awful to batch with , they treat their customers corresponding rubbish , and have a miserable fixture facility to equal their products ."
0,"it would just spin up and stop , and display "" no disc "" . "
0,"it would just spin up and blockade , and show "" no disc "" . "
1, Over for the price this is a good unit .
1, Over for the price this is a unspoilt unit .
1, I was looking for portability and good battery life and this product delivers both .
1, I was looking for portability and proficient battery life and this ware delivers both .
0,"After consulting with Creative's customer support, they determined that the hard drive was broken and the only recourse was to send it in for repair, which would cost me $40, since it's past the 90 day warranty (pretty short warranty). "
0,"After consulting with Creative's customer underpin, they determined that the hard take was erupt and the only resort was to send it in for fixture, which would cost me $40, since it's past the xc day warranty (pretty brusque guarantee). "
0,i did not managed to make creative nomad explorer to work . 
0,i did not managed to piddle creative nomad explorer to bring . 
1,"Having done all this, I was quite pleased to see that all corners I needed were decently covered by the signal. "
1,"Having do all this, I was rather pleased to see that all nook I needed were decently covered by the signalize. "
0," The speakers are very small and can not handle loud volume gracefully as voice coils top and bottom out , they clip the audio ."
0," The speakers are very small and can not handle loud intensity gracefully as voice volute transcend and prat out , they clip the audio ."
1,It makes the Nomad I purchase feel and look like junk.  
1,It attain the Nomad I buy feel and look like junk.  
1, This system is very powerful .
1, This scheme is very powerful .
0,"however , the calls constantly drop in my area and i experince mega-static , to the point where i 'd have to dial numbers 6-7 times to get a clear line . "
0,"however , the promise constantly drop in my area and i experince mega-static , to the stage where i 'd have to dial numbers 6-7 times to receive a exonerated contrast . "
1,"in terms of the shots taken , this camera is insanely great ! "
1,"in terms of the pellet taken , this camera is insanely swell ! "
1," I 'm very happy with these , I 'll probably buy 2 more for the front channels ."
1," ace 'm very happy with these , I 'll believably buy 2 more for the strawman channels ."
0,many of our disney movies do n't play on this dvd player . 
0,many of our disney pic do n't run on this dvd player . 
1,The I-Pod is the best thing I have ever used. 
1,The I-Pod is the better affair I have ever used. 
1, This computer has an excellent screen size and quality -LRB- for a netbook -RRB- .
1, This computer has an splendid cover size and quality -LRB- for a netbook -RRB- .
1,it will read and play all cd audio disc . 
1,it will read and play all CD audio disc . 
1," If I were to rate these speakers on my listening needs , I would give a 2.5 stars , but I 'm giving 4 because I think they do the job that most people want them for ."
1," If I were to rate these speaker on my listening needs , iodin would generate a 2.5 stars , but I 'm return 4 because I recall they do the speculate that most people wish them for ."
1,"overall build quality, good macros-results, impressive video-quality, good pictures with flash (good colours, sharp results), excellent auto white balance."
1,"overall build quality, practiced macros-results, impressive video-quality, good pictures with flashbulb (good semblance, sharp results), excellent auto white balance."
1,I must admit its not the best looking phone ever but then it has this look of static and absolute conviction that looks like everything a phone should be
1,ace must admit its not the Best expect phone ever but then it has this spirit of static and absolute conviction that aspect like everything a phone should be
1,"big lcd screen - at least for me, 2"" is enough"
1,"liberal lcd screen - at least for me, 2"" is sufficiency"
0,"finally the software used to put all the songs into it is vastly inferior to itunes on two levels , first it is poorly integrated into the overall player and clunky to use especially with tagging and second the wma audio format sucks , flat out sucks in terms of sound quality compared with the vastly superior aac format the apple ipod uses and it sticks you with one of the sub par paid music services such as napster instead of allowing to use the itunes store , which , if you ever plan to pay for your music , is by far the best . "
0,"finally the software utilize to put all the songs into it is vastly deficient to itunes on two tier , beginning it is unwell structured into the overall player and clunky to utilisation especially with tagging and irregular the wma audio format sucks , vapid out sucks in damage of wakeless caliber compared with the vastly superior aac formatting the apple ipod habituate and it get you with unrivaled of the sub par paid music service such as napster instead of tolerate to use the itunes fund , which , if you ever plan to earnings for your music , is by far the best . "
1,"I had a Casio unit, which had given great service, and would have been happy to get another one, but was tempted by the iPod's sleek design, storage capacity, connection options- - firewire and USB, and its integration with iTunes.   "
1,"ane had a Casio unit, which had founder dandy service, and would have been happy to grow another I, but was tempted by the iPod's satiny design, warehousing capacity, connection options- - firewire and USB, and its integration with iTunes.   "
1," In addition , it comes with a remote control ."
1," In addition , it derive with a remote control ."
1,"but if you 've used a slr 35mm camera , the controls are very intuitive ! "
1,"but if you 've used a slr 35mm camera , the insure are very nonrational ! "
1,"it hasnt gone below the second notch ( i charge mine whenever i 'm at home and not using it ) , so the battery life seems fine ( so far ). "
1,"it hasnt proceed below the second notch ( i lodge mine whenever i 'm at home and not employ it ) , so the battery life appear ticket ( so far ). "
0,Among its weak points is the MMC slot location and a bit vague design.
0,Among its weak points is the MMC slot locating and a bit vague intention.
1, I really liked the size so I researched what to buy and this was it .
1, single genuinely liked the size so I researched what to corrupt and this was it .
1,We lysol the champ every time we change the bag out and have not had any problems.
1,We lysol the champion every time we commute the pocketbook out and have not had any problems.
1,- uploading music is quick and easy . 
1,- uploading euphony is quick and easy . 
1," Overall , it is an impressive display ."
1," Overall , it is an impressive exhibit ."
1,so much packed in a small case and very affordable ! 
1,so much packed in a low cause and very affordable ! 
1," The clarity and contrast are exactly what I was looking for in a monitor , and spec for spec , it is a bargain compared to other brands ."
1," The lucidity and demarcation are exactly what I was see for in a reminder , and spec for spec , it is a bargain compared to other denounce ."
0,"Of course one of the first things I did was write an email to the customer support at Creative, through their website, and by the time they finally got back to me - several working days later when they promise only one - their suggestions were completely worthless. "
0,"Of course one of the low things I did was write an email to the customer living at Creative, through their website, and by the time they finally stupefy rearwards to me - several influence days later when they anticipate only unitary - their suggestions were wholly slimy. "
1,I recently bought the Linksys WRT54G router and have been very happy with the router itself. 
1,single recently corrupt the Linksys WRT54G router and have been very well-chosen with the router itself. 
1,the pictures are fabulous and their is a ( short ) learning curve to it ; there are tons of features i have n't even gotten to . 
1,the pictures are fabulous and their is a ( abruptly ) learning swerve to it ; there are tons of features i have n't fifty-fifty aim to . 
1,But the product iself is great.  
1,But the product iself is neat.  
1," The D-Link has a ton of features including USB printer sharing , two wireless networks -LRB- one not connected to the LAN -RRB- , and a really comprehensive settings menu ."
1," The D-Link has a ton of characteristic including USB printer share , two wireless networks -LRB- unrivaled not unite to the LAN -RRB- , and a really comprehensive context menu ."
0,"so , i 've had it for a month , and the headphone jack went out . "
0,"so , i 've had it for a month , and the headphone mariner function out . "
1,"As the 6600 uses 900mhz, it operates in more countries than the 6620."
1,"As the 6600 usage 900mhz, it engage in more countries than the 6620."
1,"Transferring music is a breeze. I don't subscribe to music services, but as mentioned on other reviews, Micro allows you to subscribe to services OTHER than iTunes. "
1,"channelise music is a breeze. I don't subscribe to medicine serve, but as advert on other reviews, Micro allows you to subscribe to serve OTHER than iTunes. "
1, Compared to the 19 '' Dell Monitor this replaced it is far brighter and weighs much less .
1, Compared to the XIX '' Dell monitor this substitute it is far brighter and weighs much less .
1,"ORIGINAL REVIEW December 2004 I'm sorry to read about other people having problems with their Zen Micro, but mine has worked great! "
1,"ORIGINAL reappraisal December 2004 I'm sorry to read about other multitude having trouble with their Zen micro, but mine has worked great! "
1,"This is my second digital camera, but I'm much more impressed with the Canon S100 Digital Elph than I EVER was with my Kodak DC240."
1,"This is my irregular digital camera, but I'm lots more shanghai with the Canon S100 Digital Elph than ace e'er was with my Kodak DC240."
1,The metal housing seems very rugged.
1,The metal housing seems very tough.
0, The only downside is the remote which requires a line of sight .
0, The only downside is the remote which requires a contrast of view .
1,It is no more heavy than any other powerful router and not as bad as some Porter Cable models I tried.
1,It is no more cloggy than any other powerful router and not as speculative as some Porter Cable pose I try.
1,"the combination of the price , storage size , and player features makes this player the best on the market . "
1,"the combination of the toll , storage size , and player features stimulate this musician the best on the market . "
0,"The Creative Zen Micro is a Zen Micro killer, not an Ipod killer. "
0,"The Creative Elvis Micro is a Zen Micro killer, not an Ipod grampus. "
0,"since i received the phone , i spent countless hours on the phone with customer service reps who promised t-zones would work "" in 24 hours "" . "
0,"since i incur the ring , i spent countless hours on the phone with customer service reps who promised t-zones would go "" in 24 hour "" . "
1,"Combine this with the excellent price we got in the Gold Box, and I'm really happy."
1,"conflate this with the splendid price we convey in the Gold Box, and I'm really happy."
1,"The back of the player is nice too, with water ripples inside the clear white coating.  "
1,"The support of the player is skillful too, with water ripples inside the clear white finish.  "
0,the 2600 had false silver plate instead of play display . 
0,the 2600 had false silver denture instead of playact display . 
1,"Overall, the Micro is a solid device and I haven't fell into a problem with it yet *knocks on wood*. "
1,"Overall, the Micro is a strong device and I haven't vanish into a problem with it heretofore *criticize on wood*. "
0,"I sent it back, as I think that the speed control is either poorly designed or defective."
0,"I charge it back, as I think that the accelerate control is either peaked designed or defective."
1,This router works at 54Mbps that's megabyte not kilobyte. 
1,This router operate at 54Mbps that's megabyte not kilobyte. 
0,"I find the major problem with this item is that if you have a very messy diaper and can't tightly bundle it without a mess, the mess gets all over the module that dumps the diaper and the stink is OUTSIDE of the diaper pail."
0,"I recover the major problem with this point is that if you have a very messy diaper and can't tightly bundle it without a pile, the stack beget all over the module that dumpsite the napkin and the stink is away of the nappy pail."
0, <p> It 's not lite on weight ... so sad ... I definately recommend it to anyone out there .
0, <p> IT 's not lite on weightiness ... so sad ... i definately recommend it to anyone out there .
0,"i have had this player for 3 months and have been able to see a total of 6 dvd 's , after the frustration and aggrivation of getting the player to do it 's job . "
0,"i have had this player for three month and have been able to envision a total of vi dvd 's , after the frustration and aggrivation of incur the player to do it 's speculate . "
1,for the money apex machines have good features . 
1,for the money apex machines have good have . 
1,the software is quick & easy to use & i found the entire process very easily mastered . 
1,the software is quick & promiscuous to use & i incur the entire process very easy mastered . 
1,"i particularly like the "" txt "" file which records all the control information for all the pictures you take. "
1,"i particularly like the "" txt "" file which records all the curb information for all the image you submit. "
1,"progressive scan player for a relatively low price ( although the better known manufacturers like toshiba , pioneer , and panasonic are now offering lower-priced progressive scan players as well ) . "
1,"liberalist scan player for a comparatively miserable price ( although the considerably known manufacturers alike toshiba , pioneer , and panasonic are now offering lower-priced progressive scan players as well ) . "
1," The display is large enough , and the text rendering is sharp enough , that you 'll forget entirely about workspace issues ."
1," The display is bombastic enough , and the text furnish is sharp enough , that you 'll block entirely about workspace outlet ."
1,"this phone has many other features , ir , ; just to name one , the features above i view as the most beneficial . "
1,"this phone has many other features , ir , ; just to make one , the lineament above i panorama as the most good . "
0,"Gets stinky after a few months, the seal on the piston doesn't seal anymore."
0,"cause stinky after a few months, the seal on the piston doesn't cachet anymore."
1, As a final comment I am happy with the D-Link DIR-655 so far and my home wireless connections are smooth whether I 'm using my ASUS netbook or Apple iPad .
1, As a final comment 1 am well-chosen with the D-Link DIR-655 so far and my home wireless connectedness are smoothen whether one 'm employ my ASUS netbook or Apple iPad .
0,There is absolutely nothing useful at the Symantec/Norton site.
0,There is dead nothing useful at the Symantec/Norton website.
1,Ive had this phone for a year now - and its the best phone I have owned.
1,Ive had this telephone for a year now - and its the adept phone one have owned.
1," The iHome , however , has markedly better stereo separation as well as bass level ."
1," The iHome , however , has markedly unspoilt stereo breakup as well as bass level ."
1,"With the enormous numbers of diapers that you go through with a newborn, it was great how easy it was to dispose of the dirty ones."
1,"With the enormous numbers of diapers that you offer through with a newborn, it was outstanding how tardily it was to qualify of the cheating ones."
1,The software that comes with the Digital Elph is very nice and intuitive.
1,The software that total with the Digital Elph is very gracious and intuitive.
1," I followed the easy instructions in the manual , and once online at the router 's login , there is a setup Wizard which will work with your OS if you choose to use it ."
1," I adopt the comfortable didactics in the manual , and once online at the router 's login , there is a setup superstar which will exploit with your OS if you choose to habit it ."
1,"So, why the small Digital Elph, rather than one of the other cameras with better resolution or picture quality? size[+2]##because, unless it's small, I won't cary it around."
1,"sol, why the small Digital Elph, rather than 1 of the other cameras with intimately declaration or film calibre? size[+2]##because, unless it's small, I won't cary it around."
1, it is lighter to carry around and it has enough functionality to use .
1, it is loose to behave around and it has enough functionality to use .
1, I 'm delighted with this product .
1, I 'm captivated with this product .
1," It is smaller than I expected when I ordered it , but as it turns out , so much the better ."
1," It is small than I expected when I ordered it , but as it spell out , so much the comfortably ."
1,"This is the first phone I know of that has the large bright screen, infrared, bluetooth, USB connector and a speakerphone."
1,"This is the initiative earpiece I know of that has the gravid brilliantly screen, infrared, bluetooth, USB connector and a speakerphone."
