class,text
0,"ace ) quite bulky ( it 's about the same size as my minolta vectis s-1 aps slr ) and use a weighty battery , although not very unanimous as it is contructed mostly of formative ( dissimilar canon 's elph descent ) "
0,"so loud , really , that it does n't work terribly well as a silent ringer option . "
0,"so forte , genuinely , that it does n't work terribly fountainhead as a silent ringer option . "
0,"having spent considerable time with professional video gear , i find onscreen displays annoying . "
0,"having spent considerable time with professional video train , i retrieve onscreen displays annoying . "
0,"some of the higher pitched rings are very easy to hear , but not easy to listen to . "
0,"some of the higher lurch reverberate are very easy to hear , but not light to listen to . "
1,the creative labs zen xtra has all the features the i-pod has and if you get if from amazon your only going to pay $ 300 for this great player . 
1,the creative labs battery-acid xtra has all the features the i-pod has and if you fetch if from amazon your only survive to pay $ 300 for this keen thespian . 
1, The technical support phone line was responsible for my giving technical support 4 stars .
1, The technical support phone line was responsible for my devote technical abide 4 stars .
1, I highly recomend theese speakers .
1, I highly recomend theese Speaker .
1," I am in the business and have seen many 19 '' LCD monitors that sell for much , much more , and aside from monitors with a higher resolution -LRB- ie 1600 x 1200 -RRB- , there is no noticable difference at all ."
1," I am in the business and have realise many 19 '' LCD Monitor that sell for much , often more , and aside from proctor with a eminent result -LRB- ie 1600 go 1200 -RRB- , there is no noticable difference at all ."
0,"The only problem I had was a few components didn't quite load correctly upon startup, but a reboot fixed the problem."
0,"The only problem I had was a few element didn't rather lade correctly upon startup, but a reboot desexualise the problem."
0,"The number buttons are crammed into a 3x4cm area, the fonts are small, the interface is too convoluted and frustrating, it's not that customisable as well."
0,"The numerate buttons are jam into a 3x4cm area, the case are pocket-size, the interface is too tangled and frustrating, it's not that customisable as well."
0,Norton support is completely pathetic.
0,Norton accompaniment is completely pathetic.
1, Way to go Apple!  
1, means to go Apple!  
0,"The adjustment knob seemed ok, but when lowering the router, I have to practically pull it down while turning the knob."
0,"The accommodation knob seemed ok, but when depress the router, I have to practically twist it down while rick the knob."
1," After much frustration , I finally upgraded the firmware to the latest DD-WRT firmware at DD-WRT 's website and it resolved all my problems ."
1," afterwards much frustration , I finally elevate the firmware to the latest DD-WRT firmware at DD-WRT 's site and it answer all my problems ."
0,The Touchpad is virtually unusable -- sometimes you have to press like mad to make a selection and other times the slightest brush causes something to be selected that you don't want. 
0,The Touchpad is virtually unserviceable -- sometimes you have to fight corresponding frantic to do a survival and other times the slightest brush causes something to be selected that you don't want. 
0,"i 've attempted to connect this unit to several different tvs , using a multitude of connection methods , and i still can 't get a video signal from the machine . "
0,"i 've attempted to tie this unit to several different tvs , use a pack of connection methods , and i ease can 't vex a video signal from the machine . "
0,about 10 % of the time it can 't find the device when i attach it to my pc . 
0,about X % of the sentence it can 't recover the device when i attach it to my pc . 
1,I got this phone yesterday and didn't find any problems with it yet.
1,iodine got this phone yesterday and didn't encounter any problems with it yet.
0, For my work this panel is unusable .
0, For my form this panel is unusable .
1,"Among my requirments for a phone were: good screen, decent camera, bluetooth, and GPRS support."
1,"Among my requirments for a phone were: good covert, decently camera, bluetooth, and GPRS defend."
0,"if you do n't have tags , it 'll lump all of your tracks into the same directory and they cannot be searched via artist or album as the zen does not recognize folders . "
0,"if you do n't have chase , it 'll swelling all of your course into the same directory and they cannot be explore via artist or album as the zen does not spot booklet . "
0,this player is not worth any price and i recommend that you do n't purchase it . 
0,this player is not deserving any Price and i recommend that you do n't buy it . 
1,This one is full of features(has bluetooth).
1,This one is full of sport(has bluetooth).
1,This thing does everything but washes your dishes.
1,This thing does everything but washes your dishful.
1,Wow - was that disappointing and we didn't even have it 6 months before it broke.
1,wow - was that disappointing and we didn't even have it vi months before it disclose.
1,I love my dark blue zen micro and would definitely recommend it.  
1,I love my dingy disconsolate zen micro and would definitely recommend it.  
1,The soft start is nice.
1,The soft part is nice.
0,"If I was pressed to find a negative aspect of the Zen Micro I would probably have to mention weak FM reception, but the building where I primarily use the Micro seems to have a history of terrible radio reception anyway, so you can take that for what it's worth.  "
0,"If I was beseech to recover a negative look of the pane Micro I would probably have to acknowledgment weakly FM reception, but the building where I primarily utilise the Micro seems to have a account of fearsome radio reception anyway, so you can have that for what it's worth.  "
1,The interface works great.  
1,The interface works smashing.  
0,"i tried calling the support number for a week , several times a day , and always got a busy signal . "
0,"i tried phone the living number for a week , several times a day , and always perplex a busy signal . "
1, Not a bad monitor for $ 120 but it 's nothing special .
1, Not a spoiled monitor for $ 120 but it 's zip special .
0,I had the second one for less than two weeks when I noticed a rattling/humming/buzzing sound while music was played.  
0,I had the second one for less than two weeks when I detect a rattle/humming/buzzing strait while music was act.  
0, The buttons are confusing and super small .
0, The clit are confusing and super small .
1,I have been very impressed with my purchase of the SD500 I bought it at the beginning of the month as the ultimate pocket camera and have shot 300 images so far with it.
1,I have been very imprint with my purchase of the SD500 single bought it at the root of the month as the ultimate pocket camera and have guess 300 see so ALIR with it.
1,nokias have always had good sound quality and this is no exception . 
1,nokias have invariably had estimable sound quality and this is no exception . 
1,i love this player and would probably go with creative labs again . 
1,i love this actor and would probably sound with creative labs again . 
0,Even with newborn diapers it filled way too fast.
0,Even with newborn diapers it filled way too debauched.
1,I have stored 40 audio CDs and i still have close to 2.8 GB free.   
1,I have stored xl audio CDs and i yet have finish to 2.8 GB free.   
0,"Other than that pictures taken in the dark are not as nice as I'd like them,"
0,"Other than that photograph select in the coloured are not as nice as I'd like them,"
0, You can not get decent mid-range or bass at lower levels without inaccurate booming from the sub woofer no matter how you tweak the levels .
0, You can not take decent mid-range or deep at scummy stratum without inaccurate booming from the sub woofer no matter how you tweak the even .
1, The sound that came from that cheap little record player sounded like Carnegie Hall .
1, The sound that hail from that crummy little record player sounded like Carnegie Hall .
1,"I loaded a lot of photos into it and they display very clearly for such a small screen and, very importantly, the transition from one photo to the next is instantaneous. "
1,"I wet a wad of photos into it and they expose very clearly for such a modest test and, very importantly, the transition from one photo to the future is instantaneous. "
1,"If you are just looking for something to keep with you at all times, then this is a great camera choice."
1,"If you are just search for something to support with you at all time, then this is a keen camera choice."
0,"the lens is visible in the viewfinder when the lens is set to the wide angle , but since i use the lcd most of the time , this is not really much of a bother to me . "
0,"the lens is visible in the viewfinder when the lens is solidifying to the across-the-board angle , but since i usage the lcd most of the clip , this is not actually lots of a vex to me . "
1, Just an average user getting good value in this product .
1, but an average user become good value in this product .
0,"as it stands now , the case is pretty useless unless you 're packing the player up for travel , or if you load up all your songs beforehand . "
0,"as it suffer now , the encase is jolly useless unless you 're compact the player up for travel , or if you shipment up all your songs beforehand . "
1,"I thought the FM radio would not see much use with so many tracks avaiable to me, but its great for tuning in to TV programs at the gym while on the treadmill, concerts and programs being simulcast, NPR, and on and on. "
1,"iodine cerebration the FM radio would not check often utilisation with so many racecourse avaiable to me, but its cracking for tuning in to TV programs at the gym while on the treadmill, concert and programs being simulcast, NPR, and on and on. "
1,"you of course have some good customization options with the unit as well ( sound presets , navigating options , playlists , etc ) . "
1,"you of course have some skillful customization options with the unit as well ( healthy presets , navigating selection , playlists , etc ) . "
0,The installation software CD crashed repeatedly. 
0,The installation software cd crashed repeatedly. 
1, Still for the price you ca n't find better for the cost .
1, however for the price you ca n't find right for the cost .
0,They obviously have quality and reliability problems. 
0,They obviously have quality and reliability job. 
1,As I drove across the country I lost reception only in eastern Kentucky's mountains.
1,A I drive across the country I lost reception only in eastern Kentucky's mountains.
1,overall i like the unit . 
1,overall i corresponding the unit . 
1,"i can recommend this phone to anyone , anytime . "
1,"i can recommend this earpiece to anyone , anytime . "
1,"If you are using Linux, and you want to use GPRS to connect to the net, I suggest this phone along with a Belkin USB Bluetooth adapter."
1,"If you are victimisation Linux, and you need to manipulation GPRS to connect to the internet, I intimate this phone along with a Belkin USB Bluetooth adapter."
1, The device is small and well designed ... I would recomment it highly
1, The device is lowly and well designed ... unity would recomment it highly
1,"if you are looking for a small camera to throw in your pocket, take great pics and video, get the SD500. "
1,"if you are seem for a small camera to project in your pocket, take great exposure and video, engender the SD500. "
1,"I rarely get drawn in by mass-commercialism, but something about the iPod made me say, in the words of Lou and Andy, ""I WANT THAT ONE!"" I was willing to shell out "
1,"I rarely convey describe in by mass-commercialism, but something about the iPod throw me enjoin, in the words of Lou and Andy, ""I WANT THAT ONE!"" iodine was willing to case out "
1," Bright , vivid , clean lines , wide viewing angle , and best of all - great price !"
1," Bright , vivid , clean contrast , wide viewing angle , and skilful of all - great price !"
1,"the 4300 is a very durable , compact package , and i find nikon to be a brand that i can trust . "
1,"the 4300 is a very durable , compact packet , and i regain nikon to be a marque that i can trustingness . "
1,"The Earbuds are great headphones as good as my AGK Studio 240, well not as good but darn close.  "
1,"The Earbuds are bully headphones as safe as my AGK Studio 240, well not as thoroughly but darn close.  "
1,We were able to obtain a Norton Corporate Edition of Antivirus only (no firewall or utilities) and so far it's great.
1,We were capable to find a Norton Corporate Edition of Antivirus only (no firewall or utilities) and so Interahamwe it's big.
1," Set up was smooth , and both wired and wireless devices worked very well on it ."
1," set up was legato , and both telegraph and wireless devices worked very well on it ."
0," However, the battery life isn't as good as I would like. "
0," However, the battery lifespan isn't as thoroughly as I would like. "
0,there was occasionally a lip-sync issue ( the lips were n't moving in time to the dialogue ) . 
0,there was occasionally a lip-sync subject ( the brim were n't moving in clock to the dialogue ) . 
0,My main complaints are that it should be deeper or wider as it doesn't even fit a smaller sized garbage bag.
0,My main charge are that it should be deeper or wider as it doesn't even accommodate a little sized garbage udder.
0,"Now the bad:  1) As usual, battery power not sufficient for daily usuage."
0,"instantly the bad:  1) arsenic usual, battery power not sufficient for daily usuage."
1,the eax settings are somewhat superfluous but not really a negative . 
1,the eax settings are moderately otiose but not really a negative . 
1,I love this pail!
1,I lovemaking this pail!
0,. images taken indoor were n't so clear . 
0,. simulacrum taken indoor were n't so clear . 
1," In short , if you 're just someone that 's a little afraid of technology , and you just want a router to get online , do basic networking and play mafiawars and browse myspace all day , this router is great for you ."
1," inch unforesightful , if you 're just somebody that 's a lilliputian afraid of technology , and you just want a router to stick online , do basic networking and sport mafiawars and shop myspace all day , this router is outstanding for you ."
1,+ the memory ( 40 gb ) is staggering . 
1,+ the memory ( twoscore gb ) is staggering . 
0," The range of response seems a little limited to me -LRB- changing the EQ setting on the iPod produces a definite change in the sound , but I would expect a little more richness in the changes -RRB- ."
0," The range of reply seems a trivial limit to me -LRB- vary the equivalent setting on the iPod produces a definite convert in the sound , but 1 would expect a little more richness in the changes -RRB- ."
1,this is the perfect camera for a photo hobbiest who wants to have easy point and shoot ability as well . 
1,this is the hone camera for a photo hobbiest who wish to have easily point and take ability as well . 
0,"i 've had this thing for less than a month , treated it quite well , never dropped it , and the headphone jack is all screwed up . "
0,"i 've had this matter for less than a month , treated it quite comfortably , ne'er sink it , and the headphone jackass is all screwed up . "
1,"I give this product five stars for its usability,performance, expandability, and definitely looks!"
1,"I founder this product five stars for its usability,performance, expandability, and definitely search!"
1,I've had this camera just over 2 years and it takes pretty good pictures.
1,I've had this camera just over 2 years and it proceeds pretty good project.
1," - Setup , from in the box to completely working , and programmed for 20 preset FM stations , was under 5 minutes ."
1," - Setup , from in the package to wholly working , and programmed for 20 preset FM send , was under 5 minutes ."
0," However , some of the latest bandwidth hogging software was starting to bog it down , to the point where I was having to reset it and my computer far too often in order to reclaim a dropped Internet connection ."
0," However , some of the up-to-the-minute bandwidth hogging software was protrude to bog it down , to the signal where single was having to reset it and my estimator far too often in grade to reclaim a dropped net connection ."
1, Monitor was easy to set up and works as promised with my newly acquired NVIDIA glasses .
1, Monitor was easy to coiffure up and crop as promise with my newly acquired NVIDIA glasses .
1,I also had no  problems installing or running the camera software on my PC.
1,I also had no  problems instalment or race the camera software on my PC.
0,"I then tried to set up the router through Linksys's browser interface, but as the only instructions available tell you to use the installation CD, I had little luck - I did manage to connect briefly, but the connection kept dropping, and with no idea of how to resolve THAT issue, I gave up.   "
0,"I then tried to lot up the router through Linksys's browser port, but as the only instructions usable tell you to use the installation CD, iodin had little luck - I did manage to connect briefly, but the connection unbroken neglect, and with no estimate of how to dissolve THAT offspring, I grant up.   "
1,extremely convenient . 
1,passing convenient . 
0,it does not have an auto-focus assist light which is nice for taking shots in low-light situations it allows the camera to focus in low light . 
0,it does not have an auto-focus assist low-cal which is nice for exact shots in low-light office it allows the camera to focalise in low ignitor . 
1,Sound: This is where I love Zen the most. 
1,Sound: This is where I lovemaking Zen the most. 
1,"Even though I never ventured into the cloth land, I was very impressed by how well this works at keeping diapers and their accompanying odor in the pail and out of our life!"
1,"Even though iodin never ventured into the cloth demesne, I was very impressed by how good this solve at maintain diapers and their consequent odor in the pail and out of our life!"
0,however the main reason i am not satisfied with this product is the fact that it will lock up at odd times . 
0,however the main intellect i am not satisfied with this merchandise is the fact that it will curl up at odd sentence . 
0,when you look through the viewfinder ( not the lcd ) the bottom left corner of the picture ( about 15 % ) is blocked by the lens . 
0,when you search through the viewfinder ( not the lcd ) the seat left corner of the word-painting ( about 15 % ) is jam by the lens . 
0,"First off, the battery."
0,"firstly off, the battery."
0,"also , the player sometimes freezes , not a very big problem , but can also be annoying . "
0,"also , the player sometimes freeze , not a very vainglorious trouble , but can also be annoying . "
0,"So, DON'T buy this or upgrade."
0,"So, DON'T buy this or promote."
1,"with 40gb of storage i have about 7,500 songs on the player ( everything music file i have is on there ) with room for about 2,500 more . "
1,"with 40gb of repositing i have about 7,500 songs on the thespian ( everything music charge i have is on there ) with board for about II,500 more . "
0,"the only beef i can raise in this regard is the pop-off face , that sometimes comes off a bit easily , but besides that it 's perfect . "
0,"the only beef i can rise in this consider is the pop-off face , that sometimes number off a bit well , but besides that it 's utter . "
0,"apparently , t-mobile is heavily back-logged and can 't keep up with demands . "
0,"apparently , t-mobile is heavily back-logged and can 't prevent up with take . "
1,"As opposed to the Nomad II or any other flash based player, the songs load extremely fast...about one or two seconds per song. "
1,"As fight to the Nomad II or any other tawdry based player, the call load extremely riotous...about one or two seconds per song. "
1, The price is very good .
1, The price is very serious .
1,Smooth plunging! ( it did stick a bit so I sprayed it w/ lubricant.
1,Smooth plunging! ( it did adhere a bit so I sprayed it w/ lube.
1,"Update I knew that I loved the champ, and useing the diaper genie at a friend's house REALLY reinforced that!"
1,"Update iodin knew that unity loved the champ, and useing the diaper genie at a friend's theatre real reinforced that!"
0,a bit dissapoitnd on that!
0,a second dissapoitnd on that!
1,"it has a handsfree loudspeaker, conference and transfer!"
1,"it has a handsfree loudspeaker, conference and transpose!"
1,Installation was as near automatic as can be. 
1,Installation was as good automatic as can be. 
1,my first impression was positive . 
1,my first impression was convinced . 
1,"While this phone obviously doesn't have the same quality construction as Motorola does, the Nokia 6600 is one of the better phones I've used."
1,"While this phone apparently doesn't have the same quality construction as Motorola does, the Nokia 6600 is one of the improve telephone I've habituate."
0,"the volume key can be hard to press , but i think this may be by design rather than a flaw , perhaps to keep you from pressing it accidentally when you are in a call . "
0,"the volume headstone can be backbreaking to weigh , but i conceive this may be by design rather than a flaw , perhaps to support you from pressing it accidentally when you are in a telephone . "
1,it 's slightly lighter than the g2 and packed with even more features . 
1,it 's slightly tripping than the g2 and packed with even more characteristic . 
1," Affordable price , reliable item and excellent customer service ."
1," low-priced price , reliable item and excellent customer service ."
0,"the headphones are not very comfortable, but most people have a certain style they like so just go buy new ones or keep the ones you have.  "
0,"the earpiece are not very comfortable, but most people have a certain style they like so just die buy newly unity or dungeon the ones you have.  "
1,"It's cheaper, holds more songs and is smaller.      "
1,"It's cheaper, throw more songs and is smaller.      "
1,One cabinet shop has been using one regularly in a router table for 11 years without a problem.
1,One cabinet shop has been using ace regularly in a router prorogue for xi years without a problem.
0,"although i find it more convenient to use 1-touch dialing , this phone does not have voice dialing . "
0,"although i find it more convenient to utilisation 1-touch dialing , this headphone does not have representative dialing . "
1,i am quite happy having over 10 gigs of music stored on this baby as well as a few gigs of media files in the data folder . 
1,i am rather glad having over 10 fishgig of music stored on this cosset as wellspring as a few gigs of media files in the data folder . 
1,So much safer than the others that require a two handed operation!
1,So much safer than the others that involve a two handed process!
1,i purchased the nomad jukebox zen xtra 40gb and it is fantastic ! 
1,i purchase the nomad jukebox zen xtra 40gb and it is grotesque ! 
0,"granted , i have only used this dvd player for about 2 hours setting it up for my mom for christmas , but that was long enough for me to find problems with this dvd player . "
0,"award , i have only practice this dvd musician for about 2 hours scope it up for my mom for Yuletide , but that was long enough for me to discovery problems with this dvd player . "
1,"- equipment included is average , but that is n't a big deal since thats not what you are buying it for . "
1,"- equipment included is middling , but that is n't a bounteous flock since thats not what you are purchase it for . "
0,Who wants to pay $30 to discuss a defect in a product that just cost $95? (I also bought the back-up CD).
0,Who wishing to pay $30 to discuss a mar in a product that just cost $95? (I also buy the back-up Cd).
1,this phone is one of the few phones that have an fm radio tuner built in . 
1,this call is unitary of the few sound that have an fm radio tuner built in . 
1,But this DOES work even if you turn off the LCD viewing -- great  battery saver.
1,But this DOES workplace eventide if you turn off the LCD viewing -- heavy  battery saver.
1,the powershot g3 is a great camera . 
1,the powershot g3 is a swell camera . 
0,yes the included earphones suck but everyone replaces them anyway . 
0,yes the included headphone nurse but everyone replaces them anyway . 
1,"1 month , no problems , great phone i 'm very pleased with my 6610 phone . "
1,"1 month , no problem , smashing phone i 'm very pleased with my 6610 phone . "
0,Norton Internet Security 2004 is one of the more buggy implementations.
0,Norton Internet Security 2004 is nonpareil of the more buggy effectuation.
0, The only drawback is the speaker wire is very thin .
0, The only drawback is the speaker cable is very cut .
0, Everything was great until it started dropping internet connection sporadically .
0, Everything was neat until it started miss internet connection sporadically .
0,The fine adustment knob which came with the router was very difficult to use on a router table.
0,The alright adustment knob which descend with the router was very difficult to habit on a router table.
0,A larger memory card and extra battery are good things to buy.
0,A orotund memory card and extra battery are unspoiled things to buy.
1,i do n't always care for gracenotes ' genre listings but it allows easy editing of id3 tags . 
1,i do n't forever care for gracenotes ' genre listing but it allows easy editing of id3 label . 
1," It 's so small , but big value Mac ."
1," It 's so small , but self-aggrandizing value Mac ."
1,i am very pleased so far . 
