class,text
0,"it played only one out of three dvd 's without problems , the other two being afflicted by a number of glitches . "
0,"it played only ane out of three videodisk 's without problems , the other deuce being afflict by a number of glitches . "
0,This is not an enterprise piece of hardware that you will find in an office or corporate environment. 
0,This is not an endeavour pick of hardware that you will regain in an office or corporate environment. 
1," The final insult is that while this router comes with useful software to make sharing printers wirelessly a snap , it 's only a trial version -- you have to download the trial software from the internet then pay an additional $ 40-60 to some unknown company to unlock all the features !"
1," The final abuse is that while this router get with useful package to piss sharing printers wirelessly a pushover , it 's only a tryout version -- you have to download the trial package from the internet then pay an additional $ 40-60 to some unknown fellowship to unlock all the lineament !"
1,Fits comfortably in my inside jacket pocket or in my pants pocket. 
1,scene comfortably in my inside jacket pocket or in my heave pocket. 
0,"yeah i agree the earbuds are pretty crap , replace them . "
0,"yeah i gibe the earbuds are pretty crap , supercede them . "
0,"the menu options appear one at a time , taking up the whole screen , and one has to scroll down one by one , or have memorized where they are in the menu order , to select them by using the number keypad . "
0,"the menu alternative appear unrivaled at a time , deal up the whole riddle , and peerless has to scroll down peerless by one , or have memorized where they are in the carte tell , to select them by using the number keypad . "
0,- this did not feel like quality construction and i was n't sure how long it would last . 
0,- this did not experience like quality construction and i was n't sure how recollective it would endure . 
1,Have had the Nokia 6600 for a year now and am generally very happy with it and with T-Mobile.
1,give had the Nokia 6600 for a yr now and am generally very felicitous with it and with T-Mobile.
0,This phone doesn't include Phone card calling.
0,This phone doesn't include Phone card holler.
1,"we hardly ever have to charge them , get great reception ( live in chicago ) , and the customization and applications are awesome . "
1,"we scarcely ever have to accuse them , get great reception ( endure in Newmarket ) , and the customization and applications are awesome . "
0,forget about the sleek looks if it can 't play some of your real dvds. 
0,forget about the streamlined appear if it can 't play some of your existent dvds. 
1,"even with these shortcomings , i still think it is the best digital camera available under $ 1200 . "
1,"even with these shortcomings , i distillery think it is the well digital camera usable under $ 1200 . "
0,"The colors are a joke, and I personally hate the stupid vertical touchpad. "
0,"The coloring are a joke, and I personally hate the dullard vertical touchpad. "
1,"first , the battery is replacable by the user , because creative intended it to be - unlike apple with the ipod . "
1,"maiden , the battery is replacable by the user , because creative intend it to be - dissimilar apple with the ipod . "
0,"That is, you cannot access the internet at all.  "
0,"That is, you cannot admittance the internet at all.  "
0,"it has a 3x optical zoom , which is average for these cameras . "
0,"it has a 3x optic zoom , which is median for these cameras . "
1, This is one of the nicest electronic devices that I 've ever owned .
1, This is one of the prissy electronic devices that 1 've ever owned .
0,it is embarassing getting phone calls from family members telling you that the dvd player you gave them less that 3 months ago is no longer working . 
0,it is embarassing have phone calls from family members evidence you that the dvd histrion you have them less that 3 months ago is no thirster working . 
0,the front cover can pop off easily but i always have mine in the case so i did n't notice after first day . 
0,the front cover can popular off easily but i always have mine in the caseful so i did n't mark after outset day . 
1,"3) Joy stick for eazy navigation, 35Mb memory card to store the pictures and stuff."
1,"3) Joy stick for eazy navigation, 35Mb memory lineup to store the video and hooey."
0, There is no speaker grill to offer any protection to the driver .
0, There is no verbalizer grill to go any protection to the driver .
1,"considering the price and specs , this might be the best buy out there for a large memory mp3 player . "
1,"view the price and specs , this might be the best purchase out there for a bombastic memory mp3 player . "
0,"i tried to play the song three times , with no success . "
0,"i tried to play the song terzetto clip , with no success . "
1," I thot my original monitor had a good image , but the S201HL has a much brighter display ."
1," I thot my pilot monitor had a skilful persona , but the S201HL has a much brighter display ."
0," D-Link support was polite and tried to help , but just worked through a script and was unsuccessful ."
0," D-Link funding was polite and well-tried to help , but just work through a script and was unsuccessful ."
1,owner 's manual has substandard troubleshooting guide . 
1,owner 's manual has substandard troubleshooting lead . 
1,Picture quality's great for still and video with sound.
1,Picture quality's great for hush and video with sound.
0,about the only legitimate criticsm from the online reviews is that fact that the lens really does obstruct the viewfinder . 
0,about the only legalise criticsm from the online recapitulation is that fact that the lens rattling does block the viewfinder . 
0,i am annoyed that the player 's not automatically recognized as a hard drive . 
0,i am annoyed that the player 's not automatically discern as a strong drive . 
1,"also , the display is "" hinged "" and it can be placed in a myriad of positions , or to protect it against any damage . "
1,"too , the display is "" hinged "" and it can be invest in a countless of location , or to protect it against any damage . "
0,fm receiver - it has none . 
0,fm liquidator - it has none . 
1,"I have especially enjoyed the 640x480 mode, while not a replacement for a dedicated video camera, its quality easily surpasses that of my old Hi-8 camera and is perfect for quick clips of things that still images just dont describe (max 8 mins at 640 30fps on a one gig card). "
1,"I have especially enjoyed the 640x480 mode, while not a refilling for a dedicated video camera, its quality easily outgo that of my sometime Hi-8 camera and is gross for straightaway nip of thing that still images just dont describe (max eighter mins at 640 30fps on a 1 gig wag). "
0,"If you call apple and tell them your ipod has been damaged, they charge you roughly $105.50 per minute and blame you for ""abusing"" your ipod."
0,"If you yell apple and order them your ipod has been damaged, they file you roughly $105.50 per minute and blame you for ""clapperclaw"" your iPod."
0,"During install, NIS would either freeze or not reboot properly when asked to do so."
0,"During install, nickel would either immobilize or not reboot decent when asked to do so."
1,"the headphone earbuds are average , so just use your regular pair instead . "
1,"the headphone earbuds are average , so just utilization your regular couple instead . "
1,great price . 
1,dandy price . 
1, This product is hard to beat at any price .
1, This product is heavily to beat at any price .
0,- the software that came with it was tough to load . 
0,- the software that came with it was yobbo to incumbrance . 
1,I've since gotten the Linksys Modem (BEFCMU10) and stacked it with the WRT54G router and it works fantastic!!! 
1,I've since experience the Linksys Modem (BEFCMU10) and stacked it with the WRT54G router and it run tremendous!!! 
1,The extra Gb is just a bonus.  
1,The spare Gb is just a bonus.  
1,I would recommend this camera unequivocally!
1,one would recommend this camera unequivocally!
1," The set up was pretty simple , basically a matter of hooking everything up and rebooting your system at which time you 're taken to the D-Link website to finalize how your setup will be ."
1," The pose up was pretty dewy-eyed , basically a weigh of cabbage everything up and rebooting your system at which metre you 're have to the D-Link website to finalize how your setup will be ."
0,I replaced it with a Router Raizer and it works much better.
0,I replaced it with a Router Raizer and it works often respectable.
1,the quality is superb . 
1,the timber is superb . 
1,I prefer things that are simple.
1,I prefer things that are elementary.
1,Glad to see the Ed. revised the previous statements regarding image quality. 
1,Glad to regard the Ed. revised the previous statements regarding image character. 
0,"Essentially, the CD included with the package is, for the most part, worthless.  "
0,"basically, the CD included with the package is, for the most component, worthless.  "
0,"The touch pad is over-sensitive, and is adjustable to only slightly oversensitive. "
0,"The equal lodgings is over-sensitive, and is adjustable to only slightly oversensitive. "
0,i just bought one and returned it as defective for good reason . 
0,i just bought one and refund it as defective for upright reason . 
1,Take quick pictures with excelent resolution
1,deal quick pictures with excelent resolution
1,I think the interface is great.
1,I think the interface is peachy.
1, These are great bike speakers for the weekend cycling in the park .
1, These are great bike speaker for the weekend cycling in the green .
1,The total price with delivery (free shipping ) was $135 !
1,The total price with delivery (disengage shipping ) was $135 !
1," Both units are small , with similarly small speakers ."
1," Both units are small , with similarly diminished speakers ."
1,it surpasses my greatest expectations in a 4mp camera .. 
1,it surpasses my big expectations in a 4mp camera .. 
1,"the 4300 comes with excellent easy to install software i use it on xp and win98 without problem , battery charger , usb and video cable . "
1,"the 4300 arrive with excellent easy to install software i utilization it on xp and win98 without problem , bombardment courser , usb and video cable . "
1,"i love all of the features , and presets as well . "
1,"i love all of the feature , and presets as comfortably . "
1, This product is definitely worth the purchase .
1, This merchandise is definitely worth the purchase .
1,"the pics can be touched up in photoshop, and be printed at 4x6 and they look great!"
1,"the movie can be touched up in photoshop, and be printed at 4x6 and they aspect peachy!"
1,"but , if you 're looking for my opinion of the apex dvd player , i love it ! "
1,"but , if you 're looking for my view of the apex videodisc player , i hump it ! "
1,So far it all works fine with either cable or wireless connections.  
1,So far it all works ok with either cable or wireless connective.  
1,"whether you 're taking a brisk jog , waiting for a bus or just having lunch at the park , you 'll be glad you had the fm radio . "
1,"whether you 're admit a brisk jog , waiting for a jitney or just having lunch at the green , you 'll be glad you had the FM wireless . "
0,"in fact , i 'd have to rate it among the worst i 've ever encountered . "
0,"in fact , i 'd have to place it among the uncollectible i 've ever happen . "
1, - Tuner quality is good .
1, - Tuner quality is unspoiled .
1,It contains the smell from our baby's diapers and we can use just about any kind of bag inside.
1,It stop the sense from our baby's diapers and we can utilisation just about any kind of bag inside.
1,I love this camera!
1,I jazz this camera!
0,Opening the Champ to empty out the bag is a little tricky- I pinched my thumb a few times before I got the hang of it.
0,open the Champ to empty out the purse is a little tricky- ace hook my thumb a few times before I incur the hang of it.
0,Still has terrible software.  
0,inactive has terrible software.  
1,"i still have over 19gb left , and already have over 200 cd 's on it . "
1,"i noneffervescent have over 19gb remaining , and already have over 200 candela 's on it . "
1, The sounds were as the movie directors intended .
1, The sound were as the movie directors intended .
0,"The only complaint I have is that the 1/4"" collet will not sufficiently hold any of my 1/4"" bits."
0,"The only ailment I have is that the ane/quadruplet"" collet will not sufficiently hold any of my one/4"" bits."
1,"Power for the tech-savvy, ease of use for the less fortunate. "
1,"might for the tech-savvy, ease of enjoyment for the less fortunate. "
0,Also the battery life isn't great but it's sufficient for my needs.
0,also the battery life isn't outstanding but it's sufficient for my needs.
1," The sound is surprising full , with a fair amount of bass , even for such a small unit ."
1," The sound is surprising full , with a evenhandedly amount of deep , even for such a low unit ."
1,"i fell in love with this camera , it combines ease of use , with an immense amount of options and power . "
1,"i fell in passion with this camera , it fuse ease of practice , with an immense amount of selection and power . "
1," They are EXTREMELY convient and you don't have to buy them seperately Has I-Tunes, which provides qulity music at low prices."
1," They are EXTREMELY convient and you don't have to buy them seperately take I-Tunes, which leave qulity music at low-pitched toll."
1,"the big backlight makes things easy to see , and the writing is big enough for people to see . "
1,"the handsome backlight makes things easy to experience , and the writing is big enough for people to reckon . "
1,night mode is clear as day . 
1,night mode is crystallize as day . 
1, These speakers are a greatg value I use them as rear speakers with polk fronts and center .
1, These speakers are a greatg value I use them as parent speaker with polk fronts and halfway .
1,seriously ! i love it ! 
1,seriously ! i enjoy it ! 
1,"it is just a tad small to hold to your ear with your shoulder , but that is solved with the very comfortable handsfree ear-piece which is included . "
1,"it is just a tad little to maintain to your spike with your berm , but that is solve with the very comfortable handsfree ear-piece which is included . "
1, Sounds awesome .
1, Sounds awful .
0,We also had a problem with diaper wipes getting caught when the top was flipped.
0,We also had a problem with diaper wipes stupefy grab when the pinnacle was flipped.
1,there are instructions to encrypt your personal wirless network so no one else can end up hogging/stealing your bandwidth. 
1,there are instructions to encrypt your personal wirless meshwork so no I else can terminal up hog/stealing your bandwidth. 
1,i like the size and weight of this little critter . 
1,i like the size and burden of this minuscule critter . 
1,I love this camera.
1,single love this camera.
1,it works great . 
1,it works swell . 
1,There is no odor and it is very easy to use.
1,There is no odor and it is very prosperous to role.
0, I bought this set it up and would not connect at wireless N speeds .
0, I bought this rig it up and would not join at wireless N speeds .
1,as said before this works perfectly . 
1,as said before this exercise perfectly . 
1, The speakers look nice and are easy to use .
1, The speakers look nice and are soft to use .
1,"for the price , it 's a very nice dvd player . "
1,"for the price , it 's a very nice videodisk musician . "
1,"this camera was affordable , very easy to learn , and produces spectacular images . "
1,"this camera was affordable , very easy to learn , and farm spectacular ikon . "
0,i have sent my ad2600 back to apex because it wo n't play certain disney and other dvd movies ( no disc message ) . 
0,i have charge my ad2600 second to apex because it wo n't work certain Disney and other dvd movies ( no disc message ) . 
1," Unless you have an enormous music/audio book library, the 20 GB model should have more than adequate storage capacity, with a stated ability to hold 5000 songs.  "
1," Unless you have an enormous music/audio script library, the 20 gilbert pose should have more than adequate storage capacity, with a stated ability to withstand 5000 call.  "
1,"seriously , this thing has everything that a pro or expert amateur could want . "
1,"seriously , this thing has everything that a pro or technical unskilled could want . "
1,"this radio receives fairly decent reception but not nearly as good as a normal radio , but as long as the stations are coming in clearly the phone 's radio should work perfectly . "
1,"this radio receives somewhat decent reception but not nearly as good as a normal radio , but as hanker as the post are coming in understandably the call 's radio should solve perfectly . "
1," excellent , very good monitor to rest the price is pretty good , I recommendt he picture is sharp and in perfect condition came to Venezuela"
1," excellent , very good varan to rest the cost is pretty good , i recommendt he flick is sharp and in perfect condition came to Venezuela"
1,It has raised the bar owing to number of features it offers and the absolute ease of use delight.
1,It has raised the block owing to number of features it offers and the absolute simplicity of habituate delight.
0, The connection is not reliable and constantly dropped .
0, The connection is not reliable and constantly throw .
1,i find the apex ad-2600 to be a great buy . 
1,i recover the apex ad-2600 to be a slap-up buy . 
1,for the most part this is a good dvd player . 
1,for the most separate this is a well dvd player . 
0,their customer ( www.apexdigitalinc.com ) service is very poor . 
0,their customer ( www.apexdigitalinc.com ) service is very misfortunate . 
0,the one i purchased for a frend as a gift will not read any dvd disc . 
0,the one i purchased for a frend as a empower will not take any dvd record . 
1,"If you on the other hand always use automatic settings (and not manual) you should be just fine, as the camera features some of the best automatic settings I have ever seen."
1,"If you on the other hand always exercise automatic context (and not manual) you should be just finely, as the camera sport some of the comfortably automatic circumstance I have ever seen."
0, Bottom Line - Do n't buy this for the USB function .
0, Bottom pipeline - exercise n't buy this for the USB function .
1,"It's easy to use, and makes transfering your CD collection to the player a cinch. "
1,"It's slow to use, and shit transfering your CD collection to the player a picnic. "
1,the progressive scan option can be turned off easily by a button on the remote control which is one of the simplest and easiest remote controls i have ever seen or used . 
1,the progressive scan option can be deform off easily by a button on the remote ensure which is one of the unproblematic and easiest outback controls i have always consider or used . 
1,one other plus is that napster now supports this device via their software . 
1,peerless other plus is that napster now subscribe this device via their software . 
1, A great system at an incredible price .
1, A heavy system at an incredible price .
1,the person on the other end of the call can hear you perfectly . 
1,the soul on the other end of the yell can hear you perfectly . 
0,"it is some protection for the unit , but for useability , forget it . "
0,"it is some auspices for the unit , but for useability , bury it . "
1,"it looks very cool , and seems quite small to me and very light . "
1,"it looks very cool , and seems rather small to me and very loose . "
1, The computer direct processing and shipping was outrageously fast .
1, The computer direct march and shipping was outrageously fast .
1,"surfing the web on it is nice as well , i just wish there were more wap pages available . "
1,"surfing the WWW on it is nice as swell , i just bid there were more wap pages available . "
1,"1 ) great sound ( > 98db signal-to-noise ratio beats ipod 's "" unspecified "" ratio ) and good power output allow the zen xtra to drive large head-phones as well as external speakers . "
1,"1 ) great sound ( > 98db signal-to-noise ratio beatnik ipod 's "" unspecified "" ratio ) and good index output allow the zen xtra to cause great head-phones as well as external talker . "
1,FM tuner & Microphone : Having a tuner in the player is a blessing. 
1,FM tuner & Microphone : bear a tuner in the player is a bless. 
1, Update : I 've been using this router for 3 months and it 's still working very well - wifi remains strong and consistant .
1, Update : I 've been using this router for terzetto months and it 's tranquillize go very well - wifi remains unattackable and consistant .
0,"I'm giving it 1 star because as compared to other Nokia phones , its a 1 , compared to other blunders by other companies (such a samsung and motorrola) it might be good .... but if you're getting a Nokia , don't get this one ."
0,"I'm generate it 1 maven because as compared to other Nokia phones , its a 1 , equate to other fuckup by other companies (such a samsung and motorrola) it might be respectable .... but if you're stupefy a Nokia , don't produce this unmatched ."
1,Works pretty well. 
1,Works pretty wellspring. 
0,It constantly drops the internet connection and simple things like WALLS in our house block the link so everything is very slow.  
0,It constantly unload the internet connection and simple things like WALLS in our house stoppage the contact so everything is very wearisome.  
1," For the price , the sound is great and their portability -LRB- pack down to a large egg-shape -RRB- is quite good ."
1," For the price , the phone is dandy and their portability -LRB- carry down to a large egg-shape -RRB- is quite just ."
1, - Sub woofer is large .
1, - substitute woofer is large .
1,having access to so much music where ever you go is terrific . 
1,having access to so much music where ever you break is grand . 
1," This is an outstanding product , one that lives up to the PR ."
1," This is an outstanding product , unity that live up to the PR ."
0,the only problem that i have found with the internet service is that it does not access mls ( real estate broker software ) very well at all . 
0,the only problem that i have receive with the internet servicing is that it does not access millilitre ( real estate broker package ) very considerably at all . 
0,"I tried it again this morning and it said I didn't have the required ""permissions"" and lacked proper administrator status."
0,"I prove it again this morning and it read I didn't have the require ""license"" and lacked proper administrator status."
0,"Next, the big reason not to buy ANY Norton product:  If there's a problem with it, Norton charges $30 to even tell them about it."
0,"Next, the grownup rationality not to buy ANY Norton intersection:  If there's a job with it, Norton thrill $30 to even tell them about it."
1,they player 's interface itself is also very easy to use . 
1,they player 's port itself is also very light to use . 
1, The device itself is pretty solid .
1, The device itself is pretty whole .
1, Purchased this item because of reviews and price .
1, Purchased this token because of reviews and price .
0, I usually avoid horns but I do n't hear anything overly extreme .
0, I usually avoid horns but single do n't hear anything too extreme .
1, I love this speakers .
1, iodin love this speakers .
1,just bought one & i 've enjoyed it to date . 
1,just bought ane & i 've enjoyed it to date . 
0,"The battery, as others have said, also seems weaker than Creative suggests.  "
0,"The shelling, as others have said, also seems weaker than Creative advise.  "
1, The first 2 routers worked good for years .
1, The first 2 routers cultivate good for years .
0,one of the dvd 's i received as a christmas present kept freezing . 
0,one of the dvd 's i received as a christmas gift keep freezing . 
1,"The startup time, quality of pictures and videos is outstanding."
1,"The startup time, quality of visualise and telecasting is outstanding."
1,"Update (March 2005): My son has been out of diapers for almost 2 years now, but the Diaper Champ hung in there till the very end - easy to use, no problems with odors, and one of the best bargains among all of the paraphernalia required for the modern baby :-)"
1,"Update (March 2005): My son has been out of diapers for well-nigh 2 years now, but the Diaper Champ hang in there till the very close - light to use, no problems with odors, and one of the intimately deal among all of the paraphernalia requisite for the forward-looking infant :-)"
1,Each battery lasts about 10-11 hours. 
1,Each battery live about 10-11 hours. 
0,2 ) scroll button / switch 
0,2 ) scroll button / permutation 
1,but this camera is great ! 
1,but this camera is big ! 
1," However , a phone call to the D-Link support crew was answered in a reasonable amount of time and they guided me through the process without a problem ."
1," However , a telephone call to the D-Link supporting crew was suffice in a reasonable amount of time and they draw me through the work without a problem ."
1,6- Small but very clear TFT screen.
1,6- Small but very elucidate TFT screen.
1,1. Record around 1 hour of video with Phillips Camcorder Pro.
1,1. Record around I hour of video with Phillips Camcorder pro.
1,"Speaking of battery, it's removable AND replaceable! "
1,"verbalise of battery, it's removable AND replaceable! "
1,"i must have differing preferences than others here , as i prefer the supplied earbuds to the sony 's that i thought sounded good on other players . "
1,"i must have differing taste than others here , as i prefer the supplied earbuds to the sony 's that i mean sound honorable on other player . "
